,title,topic_idx
44543,이무성 명지대 교수 한국유럽학회장 선출…한국유럽 가교될것,2
36093,아쿠아리움 제119회 독도의 날 특별 수중공연 편성,3
16224,트럼프 10월1일 예정된 중국산 관세율 인상조치 2주 연기,4
31194,신한알파리츠 종속회사 유상증자 신주 670억에 취득,1
26165,한화투자 현대리바트 2분기 호실적…매수 유지,1
21710,크레모랩 단돈 100원짜리 쿨딜 이벤트,3
41120,포스코 벤처 발굴·육성 아이디어 마켓플레이스 개최,1
14098,伊 베네치아 운하서 수영한 관광객에 60만원 벌금·추방 철퇴,4
41644,현대제철 서울 잠원동 사옥 판다…현금 확보 차원,1
12895,방중 재검토 靑요구 일축했지만…곤혹스런 더민주,6
4320,日아베 하메네이 핵무기 제조·보유·사용 의도 없다 말해,4
1588,네이버 이미지 검색 고도화…DB 2배 이상 확대,0
31534,日극우혐한인사들 선거 출마…브렉시트·트럼프 바람 기댈듯,4
9506,김성녀 국립창극단 예술감독 국립극장장 공석 속 임기 연장,3
22466,몸짓 향연 춘천마임축제 21일 개막…8일간 열려,3
37953,전북도 실직자 등 취업 취약계층 1만명에 공공일자리 제공,2
24063,朴대통령 새누리당 의원 초청 오찬…국정협력 당부 전망,6
33650,北 테러조 10여개 中·동남아에 파견…김정은 직접 지시종합,6
14679,우간다 대통령 북한과 안보·군사 협력중단,4
39474,피부미용 의료기기 기업 이루다 내달 코스닥 입성,1
44622,넥슨 콘솔PC 넘나드는 카트라이더 드리프트 공개,0
14205,주말 N 여행 여행사진 뗄수 없는 짝꿍…어떤 카메라가 좋을까,3
38608,경기북부 밤사이 40∼60㎜ 강우…이례적 겨울비,3
24891,대전에서 열린 제1회 전국 청년상인 페스티벌,2
11699,노조 240명 vs 조합 90명…광주 시내버스 운전원 충원 시각차,2
40733,포스코케미칼OCI 고순도 과산화수소 합작법인 설립종합,1
15107,홍영표 미세먼지 국가재난사태 선포 긍정적,6
33685,프로야구 한국시리즈 5차전 시구에 배우 구혜선,5
4128,김연경 13점 한국 女배구 올림픽 예선서 멕시코에 3...,5
27912,이스라엘 총리 헤즈볼라 지도자에 진정해라…드론사건 경고,4
38326,오스템임플란트 3분기 영업이익 237억원…작년 대비 118.3%↑,1
9120,황금돼지해 맞나 중국 TV서 돼지 찾아보기 힘들어,4
36467,美 캐나다·멕시코 철강관세 철폐…새 북미무역협정 비준 탄력종합,4
19831,트럼프 재선 출정식 생중계하는 취재진,4
18913,MLB닷컴 최지만 우투수 전담 DH로 가치…추신수도 D...,5
2026,주말 N 여행 수도권 넣으면 나온다 송어 낚시…서울 세계 최대 초콜릿축제,3
26350,中 연휴에 관광지 인산인해…누리꾼 사람 구경보다 집이 좋아,4
32562,LGU 30만원대 스마트폰 갤럭시J6 내일 단독 출시,0
37236,게시판 하나금융 대구 영유아 양육 가정에 놀이꾸러미 지원,2
43712,화가 프리다의 사상 이해 안돼…벌집 쑤신 주멕시코 美대사,4
32114,리비아 군벌 트리폴리 외곽 공습…정부군도 반격작전,4
23477,이총리 소상공인·자영업자 대책 임차료·카드수수료 완화,1
9457,tvN 프로그램 체험하는 즐거움전 2018 11월 개최,3
7641,긴급 당정청회의 참석하는 김동연과 홍영표,6
30299,전북 오전까지 약한 빗방울…출근길 안개 주의,3
36315,무디스 은행 결제망 개방 한국 카드사에 부정적,1
7658,NH농협은행 판매액 0.01% 농산물기금 쌓는 정기예금 출시,1
13015,여자농구 KDB생명 해체 전 마지막 경기에서도 패해 22연패,5
41534,SNS돋보기 中 세계 최대 전파망원경으로 펄서 발견…우리는 언제,0
27118,팬에게 공 집어 던진 NBA 선수 벌금 2천700만원 징계,5
2139,방중 北 김정은 인민대회당 도착…시진핑과 회담할 듯,6
15833,與 호남 지역구 축소 최소화…지역구 250이냐 245냐가 관건종합,6
33960,정부 재송신 협상 가이드라인 확정…근거자료 제시 의무화종합,6
43618,게시판 과기정통부 SW마이스터고 여름SW캠프 개최,0
18029,월드컵 팀 첫 번째 골 넣는 손흥민,5
14614,세계한인무역협회 올해 차세대 무역인 1천550명 배출한다,2
32903,게시판 롯데월드 어드벤처 개장 30주년 맞이 여름축제,3
7136,포항 바다 보트 전복 헬기 구조,2
7122,대권도전 시사한 반기문 확대해석돼 곤혹종합2보,2
38848,특징주 스마트폰 부품株 아이폰7 출시에 무덤덤,1
5626,스페인 축구스타 토레스 日 사간도스로 깜짝 이적,5
18669,여자농구 신한은행 KDB생명에 대승…5연승 휘파람,5
41292,대전외고 통학차량 기사 확진…29일부터 원격수업,2
18825,KBS 진미위 징계 요구 효력정지에도 진상규명은 계속종합,2
1826,몰타 해군 지중해에서 아프리카 난민 75명 구조,4
43437,안양시 올해분 교통유발부담금 30% 감면…코로나19 고통 분담,2
2606,이란 최고지도자 팔하마스 만나 대이스라엘 항전 치하,4
2663,러시아 징계당해도…한국 女배구는 亞예선 통과해야 올림픽 출전,5
38793,위안부 문제 다룬 다큐멘터리 주전장의 데자키 감독,3
14005,파크론 이사철 맞이 퓨어디자인 거실매트 에스닉무드 출시,1
45141,게시판 기자협회경상북도 가짜뉴스 배격 업무협약,2
2294,스타트업 창업초기 해외 진출 바람직…성공 열쇠는 인맥,1
14723,카카오게임 음양사 예약 100만 돌파,1
11048,美 슈퍼화요일 민주 흑백투표…공화 남부표심 반쪽,4
20335,佛 시위진압경찰 때린 전 복싱챔피언 돕기 모금 논란 끝 중단,4
23875,제2의 양의지 사태 막자 KBO선수협심판위원장 회동,5
16237,KTB투자증권 동아에스티 3분기 실적 쇼크…목표가↓,1
5182,웅진씽크빅 오바마 부부 자서전 한국어판권 계약,3
25913,지명타자 이대호 역대 3번째 3개 포지션 황금장갑,5
7988,부산 7일 만에 시원한 비…폭염경보→주의보,3
15543,朴대통령 원로과학자에 감사인사 발전의 뿌리 돼주셨다종합2보,6
8742,예테보리도서전 폐막…북유럽서 K북 가능성 확인,3
24131,이집트서 쥐 미라 들어있는 2천년전 고대무덤 발견,4
6942,伊 민주당 오성운동과 새 연정 협상 긍정적이었다,6
32107,흐리지만 포근한 휴일…충북 유원지 행락객 북적,3
29907,네이버 제2 IDC 클라우드에 특화…이해진 전세계 데이터 거점종합,0
3652,국회 선진화법 7년만에 무력화…편법·반칙 수단 전락,6
38017,토트넘 아르헨티나 19세 수비수 후안 포이스 영입,5
9717,이정현 골목상권 침해 정치권이 감시해야종합,2
15858,프로축구2부 아산 서울 이랜드 31로 꺾고 선두 수성,5
28105,2연승 삼성화재 4위 탈환…한국전력은 개막 15연패,5
28494,홍콩 앞바다 군사훈련 공개한 중국…사태 악화 땐 개입 경고종합,4
22784,LG유플러스 제휴 알뜰폰 사업자에 아이폰6 공급,0
8773,데이비스 45점 뉴올리언스 연장전 끝에 보스턴 8연승 저지,5
18890,朴대통령 인천상륙작전 관람…국민단합 신념 반영,6
2537,유벤투스 이탈리아 FA컵 우승…가자 트레블,4
30578,인간배아의 중요 유전자 OCT4 베일벗었다,0
2540,프로농구전망대 절대 1강 현대모비스 2약 DB...,5
13818,푸틴 INF 파기한 美 미사일 배치하면 러시아도 미국 겨냥종합2보,4
25851,부모 등 부양가족 위장전입 기승…청약가점제 손본다,6
27469,파키스탄 칸 총리 핵 지휘부 소집 인도에 보복 다짐,4
38362,춘천시 외국인 유학생에 겨울 외투 나눔 추진,2
12957,게시판 금투협 로보어드바이저의 이해 교육,1
4832,美 독립리그에서 프로야구 최초로 타자가 1루 도루,5
38588,보수 시민단체 이인영 통일·이정옥 여가부 장관 검찰 고발,6
23054,U20월드컵 이탈리아 승부차기로 우루과이 꺾고 3위,5
32138,인민일보 개혁개방은 위대한 혁명…문혁입장 우회표명,6
42555,대전교육청 중학교 학교군·중학구 축소 행정예고,2
40697,서울대 대학원생 코로나19 확진…기숙사 일부 폐쇄,2
37005,소재 불명 다빈치 살바토르 문디 사우디 왕세자 요트에 있다,4
37137,속보 학생 17명·교직원 3명 코로나19 신규 확진,2
4253,삼성 빅스비 장터 이번주 개장…생태계 확장 본격화,2
26110,MLB 시카고 컵스 팬 아이디어 도용 혐의로 피소,5
24671,대한항공 비예나·정지석 폭발…현대건설 이다영 10득점 활약...,5
3755,與 의원평가 앞두고 법안발의 2배 폭증…평가기준 불만도 폭주,6
7693,서브 압도 현대캐피탈 KB손해보험 꺾고 5연승 질주,5
22089,단독 국립오페라단 신임 단장에 윤호근 지휘자 내정,3
32659,손흥민 EPL 공격수 순위 14위英 텔레그래프,5
31321,애플 韓맞춤형 광고 첫 공개…국내 캐릭터·한글 디자인 활용,0
8343,이란 유럽이 핵합의 안 지키면 5단계 이행 축소,4
938,문 대통령 장성 진급자들에 삼정검 수여…신뢰받는 軍 이끌라,6
978,춘천을 드론 체험 명소로…드론 페스티벌 내달 개최,3
3919,美 제재에 이란 최고 인기 프로축구도 지장…외국인 감독 이탈,4
6746,민주 부산시당 성추행 사건 가해자 징계 절차 착수,6
4528,신간 중국의 리더들·땅의 역사,3
9408,경제계 최저임금 결정기준안에 기업 지불능력 포함해야,1
11094,폼페이오 터키·시리아쿠르드 모두에 좋은 결과 가능,4
13510,제3정당이냐 與과반저지냐…安과 千·金의 동상이몽,6
7549,두테르테 필리핀 대통령 방한…내일 문대통령과 정상회담,4
25404,트럼프 미군 시리아 철수 며칠 심사숙고 끝에 결정,4
6869,이란 미국인 1명 체포…미 정부에 즉시 통보,4
15919,백악관 이스라엘일부 아랍국가 비교전 협정 추진,4
16511,갤럭시노트9 13일부터 예약판매…예정보다 하루 당겨종합,0
32089,주말 N 여행 제주권 겨울숲 걸어보셨나요…고요 그 속에서 나를 비우다,3
33271,호주 온두라스 꺾고 31번째 국가로 월드컵 본선 진출,5
11088,순수의 세계는 어떻게 파괴되나…소설 공산,3
44414,주변 빛 흡수해 1시간 넘게 빛내는 유기인광 개발,0
9375,추석 연휴 열차 승차권 127만석 팔려…예매율 34%,3
19951,홍준표 댓글로 일어선 정권 댓글로 망할 수 있다,6
1295,감빵생활 실상은…어느 서울대생의 수감기,3
9406,보광산업 주당 1주 무상증자·현금배당 결정,1
17261,속초시 시립박물관에 전천후 야외 공연장 조성,3
41507,항소심 선고공판 출석하는 권재홍 전 MBC 부사장,2
16943,朴대통령 남은 22개월 가시밭길…巨野 설득·협조가 관건,6
9129,팔레스타인이스라엘 충돌 격화…사흘간 최소 15명 사망종합2보,4
39258,농진청 캄보디아서 사료용 잡종 옥수수 개발,2
30862,이스라엘 홀로코스트 미술품 100점 베를린서 전시…메르켈 참석,4
531,美폴란드 5G 네트워크 안보 협력…화웨이 견제,4
14321,아시안게임 박항서호 응원하자 베트남팬 열기에 자카르...,5
24542,獨·日·호주 콩고 에볼라 확산 방지에 2천만弗 추가지원,4
30255,금 나노입자로 체세포→신경세포 전환…파킨슨병 치료 기대,0
17117,북한 박근혜 정부 3년은 죄악에 찬 나날 비난,6
30406,한국당 내일 정경두 국방장관 해임건의안 제출,6
11955,캐나다 학교서 총기사건…경찰 2명 사망·다수 부상,4
21767,삼부토건 의안상정 가처분 피신청,2
36969,항생제 콜레라균 증식 환경 조성 확인,0
16821,女배구 드림팀 5일 태국과 대결…1승 1패 한국 이번...,5
28578,축제가 있어 더 즐겁다…충남 가을축제 풍성,3
17456,30대 탈북자 러시아 망명 거절당해 본국송환·처형 위기,4
5601,환경부5대 발전사 통합환경허가 MOU,2
26108,원자력안전위 월성 3호기 재가동 승인…정지 3개월만,2
12836,지시 따랐더라면 큰일날뻔 트럼프 구해낸 참모들,4
7150,美 사상 최대 규모 자폐증 연구…5만명 유전자 분석,4
24159,안민석 도쿄올림픽 욱일기금지 결의 日전달 시도…면담 미성사,2
6678,靑 김정은 가까운 시일 내 답방 평양선언 약속 지켜질 것,6
1440,자전 출간한 황석영 작가는 언어의 감옥에 갇혀 있다,3
21921,여자배구 러시아에 통한의 역전패…올림픽 직행 티켓 놓쳐,5
45029,무소유 법정스님 10주기 추모집 낡은 옷을 벗어라 출간,3
15517,부도 송인서적 24일 법원에 기업회생절차 신청한다,1
44966,통일 심포지엄 남성욱 통일 위한 21세기 新한국책략 필요,6
17520,갤럭시S10 성원 감사 고동진 전세계 소비자에 이메일,1
4554,화웨이 1분기 영업익 3배 뛰었지만…美제재로 전망 흐림,1
23410,어제만큼 더워요 낮 최고 20∼33도…수도권 오존농도 나쁨,3
27681,페덱스 또 화웨이 배송사고…中매체 블랙리스트에 올려야종합,4
1384,라인 셀피 전용 앱 B612 1억5천만 다운로드 돌파,1
40716,주말 N 여행 아무도 몰라야 진짜 휴가랍니다… 비밀의 계곡 3選,3
4088,송희경 식품연구원 해임된 비리 연구원에 퇴직금 100%,2
17723,밀양이냐 가덕도냐 동남권 신공항 결과 오후 3시 발표종합,2
9175,요미우리 2군 감독으로 변신한 아베 체벌은 절대 안 해,5
32450,번트·번트·번트…역전의 명수 군산상고 고의 져주기 논란,5
43619,인천서만 시행된 온라인 학력평가,2
30815,美캘리포니아 전력회사 산불예방 17개 카운티 강제단전 검토,4
12275,영상 비싼 아이폰XS 수리비도 역대급,0
33861,천리안위성 1호 장애 복구 완료…사흘 만에 정상 운영,0
17065,SKT 자율주행차 프로야구 개막전 시구 도우미로 활약,5
13906,매달 젊은 피…벤투의 시선은 이미 아시안컵 그리고 그 뒤,5
4885,국립국악원 정악단 예술감독에 피리연주자 이영,2
9226,삼양옵틱스 최대주주 지분 매각 검토 중,1
5584,미국 남성잡지 플레이보이 한국판 창간…누드는 없어요,3
15914,초고령사회日 노인 교통사고 골치…면허반납 독려에도 26% 운전,4
27842,한라산 422㎜·서울 69㎜…내일도 경남해안·제주 많은 비,3
21000,박지성 축구협회 유스전략본부장 영국 런던서 모친상,5
27160,허리 통증 파다르 정밀검진…챔프전 투입 여부 미정,5
3404,北 반년 만에 완공 백두산영웅청년3호발전소 준공식,2
36637,노딜 브렉시트 우려…英 응급처치용 의료장비 비축,4
29504,배구협회 프로팀 이적 시도 김호철 감독 스포츠공정위에 회부,5
22516,과기부 글로벌 정보보호 트렌드 세미나 개최,2
25052,어르신에게 인사하는 안철수,6
3099,中사령관 美사령관에 도발 무섭지 않아…인공섬 포기 안해종합,4
40507,임진강 독개다리에 평화의 가상철로 선보인다,2
37085,이재균 부산항경쟁력강화協위원장 항만공사 묶인 발 풀어줘야,2
43112,석남이경성미술이론상에 미술사학자 김현숙,3
7307,NBA 폴 벌금 2천600만원 징계 동료에게 내가 내줄게,5
9597,술 취한 여성 성폭행 의혹…넥센 박동원·조상우 구속영장,2
9070,기쿠치 MLB 시애틀 입단 합의…최대 7년 계약종합,5
9940,소프트웨어에 힘주는 삼성…첫 빅스비 개발자 데이 개최,0
8594,게시판 서울시 중증장애인 인턴 모집,2
8749,시리아 해법 놓고 러시아·터키·이란 3국 정상회담 개최,4
30596,프로배구 온라인 영상 콘텐츠 강화사업 입찰 공고,5
610,노경은 406일 만에 등판해 4⅓이닝 1실점…질롱 끝내기 승,5
17281,손세이셔널 인기 절정…개장 앞둔 손흥민 체육공원 관심,5
684,잉크 뒤집어쓴 알바니아 총리…의회 답변 중 야 의원 공격받아,4
13172,추신수 2루타볼넷 2개 묶어 3출루·3득점,5
34877,카카오 챗봇 도입 후 고객센터 문의량 10% 감소,0
898,IS 부활 우려 현실화…터키 공격 틈타 활동 재개,4
39568,김제시공무원노조 국외 여비 전액 반납…코로나19 고통 분담,2
8398,아시안게임 황재균 홍콩전에서도 유격수 선발 출전,5
24523,KEB하나은행 금융 API 공개하는 개방형 플랫폼 열어,1
38121,인문사회 분야 유망 연구자 지원한다…총 120억원 규모,2
6307,마크 테토가 본 한국의 미…서울옥션 한 달간 부산 특강,3
8767,인수위 없는 새 정부…당선인 신분 없이 곧바로 임기 시작,6
1123,NGO 난민구조선 또 입항금지 명령 어기고 伊항만 진입,4
42308,파주시 내년 장애인 일자리사업 참여자 133명 모집,2
13883,北 김정은 신년사서 경제강국 건설 주문…전력문제 언급종합,6
37737,하나은행 내달 6일부터 의사·변호사 등 전문직 대출한도 축소,1
9798,北 당대회 앞두고 기강잡기…70년대 당일꾼처럼 투쟁,6
11682,美규제안에 철강株 엇갈린 반응…영향 제한적 분석도,1
41114,신풍제약 자사주 2천억원어치 매각…장중 주가 24% 급락,1
44557,미량의 원소까지도 놓치지 마라…이차 방사선 기술,0
39682,한국당 문재인정부 사생활 지침도 만드나…말만 규제혁파,6
36451,북한날씨 35도이상 고온현상…건강관리 유의,3
6469,사막체험 소원 이룬 문 대통령…왕세제가 리조트·헬기 내줘,6
21525,류현진 복귀전서 옐리치에 연타석 솔로포 헌납…빛바랜 9K...,5
13112,신간 서울은 왜 이렇게 추운겨·과거로부터의 행진,3
21212,창업 긴 줄,1
23927,野 중도파 중진들 개헌논의 가속…연속 토론회 열며 군불,6
43161,캐나다서 10년간 성병 급증…앨버타주는 매독 비상 선포,4
21946,軍 北 서북도서·수도권 타격위협에 강력규탄·단호히 응징,6
12258,英 의원 70여명 어산지 스웨덴서 성폭행혐의 수사 받아야,4
35401,이별 요구 내연녀 가짜 총 위협한 50대 체포,2
20209,EU 생태계 위협 미세플라스틱 사용제한 법제화 추진,4
13364,FC바르셀로나 뎀벨레 영입 공식 발표…이적료 1억500만 유로,5
40702,돌봄 대란 재현되나…강원 학교 비정규직 24일 총파업 돌입,2
33370,NBA 밀워키 보스턴에 완승…승부는 7차전으로,5
35659,창원 장미공원 개장,3
2032,미성년자 276명 성적학대 콜롬비아 30대 남성에 60년형,4
35980,일문일답 靑 중요한 시점에 남북정상회담…특사단 파견 공감,6
27278,차세대 전지 후보 나트륨전지 전극 소재 개발,0
29984,인간과 로봇의 컬링 대결,0
4822,삼성 갤노트10 국내 사전판매량 130만대…전작 대비 2배↑,1
34896,네이버 클라우드 국제 보안인증 최고등급 획득,0
9174,화천 쪽배축제 내달 29일 개막…16일간 이어져,3
34935,SK 최정 역대 6번째 13년 연속 두 자릿수 홈런,5
38884,대진대 법인 이사회 일방적 총장 선임에 교수협 반발,2
29827,SKB 옥수수 러시아 월드컵 누적 시청자 1천만 돌파,5
38092,증권업계 한은 양적완화 환영…금융시장 안정 도움,1
28583,정규리그 우승을 향해 현대캐피탈·도로공사 나란히 승리종합,5
45438,JR글로벌리츠 내달 코스피 입성…국내 첫 해외부동산 리츠,1
36998,충주 목계나루서 카누·카약 즐기세요,3
29274,네이버 블로그 광고 이용자 2천200명 개인정보 유출,0
41436,밥 브래들리 전 스완지 감독 美축구 LAFC 사령탑에 선임,5
11895,은성수 확고한 금융시장 안정 최우선 과제…금융혁신도 가속,1
6200,말레이시아 총리 美재무장관 면전서 對이란 제재 반대,4
16116,영상 태풍 제비 북상 중…한반도 올 가능성은,3
41747,역대 남극 월동대원 한자리에…극지인의 밤 행사,3
42182,대전서부교육지원청 나이스 운영 우수기관에 선정,2
20238,카드뉴스 불법 채취 스릴 산행…가을 등산 문화의 현주소,3
27601,한부모 가족 인권선언문에 박수치는 김정숙 여사,6
10438,인도 중국 턱밑에 미사일 부대 배치…갈등 증폭 예고,4
33082,갤S9 부진에 삼성 스마트폰 2분기 주춤…영업익 2.7조,1
36699,5월 회사채 발행 11.4조원 54%↑…코로나19 이전 수준 회복,1
13928,5세트 가빈 이탈 후 역전…대한항공 선두로 반환점 돌아,5
29119,제철소 대기오염물질 무단배출 사태 대응 기자회견,2
40820,남북단일팀 서효원과 한 조 이룬 북한 김송이,6
30966,악 햄스트링 바르사 수아레스 부상으로 2주 이탈,5
33670,한러 북핵 수석대표 회동…북미 회담 뒤 한반도 정세 협의,6
30607,관광버스기사 산재사망 인정…대법 대기시간 온전한 휴식 아냐,2
39468,약국 덮친 승용차,2
35330,조지아인 살해 배후로 러시아 의심 독일 러 정보원 2명 추방,4
34142,신간 여기가 끝이라면,3
10817,차ㆍ포 뗀 두산 수비마저 흔들…전력 우위 사라졌다,5
20226,커리 0.5초 남기고 결승포 골든스테이트 클리퍼스 꺾...,5
29401,더 똑똑하고 편리하게…구글 번역·포토 AI 접목,0
4817,15년 만에 류경정주영체육관에 선 허재 감회가 새롭네요,5
43903,신태용호 침몰시킨 비슈차 한국 수비에 문제 있었다종합,5
8521,게시판 예금보험공사 혁신추진위원회 출범,2
42892,과기부 황우석 전 교수 최고과학기술인상 16년 만에 취소,2
39232,경찰 목조르기로 숨진 에릭 가너 딸 샌더스 광고 등장,4
36469,伊 대통령 새 연정 승인…콘테 현 총리에 연정 구성 권한 부여,4
12989,김의겸 진보개혁 성향 신문기자 출신…최순실 특종 명성 종합2보,2
20528,대립 격화냐 협치 강화냐…갈림길 선 여야,6
8912,가오슝 야시장의 한궈위 굿즈 노점,4
12076,2016년 새해 첫날 부산 해맞이 인파 35만명,3
19113,이효성 방통위원장PP업계 대표자 간담회,2
29617,바른미래 파열음…지도체제 바뀌어야 깨끗하게 갈라서자종합,6
29211,상반기 전자단기사채 574조원 발행…22% 증가,1
3458,신간 밥벌이의 미래,3
2078,스페인 최초 좌파연정 한발짝 앞으로…오늘 표결,4
4399,정해구 대북제재 해제 대비한 남북 경제교류 대응방안 구상,6
43986,공항 못지않은 토익·HSK 시험장 방역…마스크·손 소독 필수종합,2
12533,홍천 내면 영하 24.4도…춥다 추워 강추위 기승,3
18624,조배숙 정부 GM 군산공장 회생 외면…재협상해야,2
33754,캐나다 BC주 2040년까지 승용차·경트럭 전차량 무공해 전환,4
17410,스페인 총선 최대관건은 카탈루냐 문제…사회당 하락세 뚜렷,4
896,베로나 AC밀란 꺾고 강등권 탈출 시동…이승우는 벤치,5
39311,신문협회 SBS뉴스에 유사 중간광고 삽입은 편법…규제해야,2
42283,IS 수괴 알바그다디 사망 이후는…점조직식 명맥 이을 듯,4
17102,개성공단 중단 중단발표에서 철수까지…긴박했던 29시간,6
30162,아이폰X 이틀간 10만대 개통…8과 쌍끌이 흥행,0
26646,월드컵 월드컵 보고 꿈 키운 조현우 나도 누군가의 꿈...,5
17533,카메룬 대통령 경호원 5명 스위스 기자 폭행 혐의로 구금,4
38664,박용만 두산 회장 최태원 SK 회장에 KS 우승축하 기...,5
2957,프랑스 마크롱 대통령 PSG회장에게 축하 좋은 소식 있...,4
12092,우루과이서 잡힌 이탈리아 마피아 두목 한밤중 탈옥,4
1974,아랍의 봄 발원지 튀니지서 총선…정치이변 이어질까,4
19852,미래부 지역 과학기술정책 역량 높인다,2
41217,스티븐 로치 미 더블딥 확률 50% 넘어…약달러 또 경고,4
5808,국채금리 치솟자 미국 주택대출금리 2년만에 최고,1
26596,배터리 최대 45% 절감 기술 KT 전국망에 첫 적용종합2보,1
12403,LG전자 외장스피커 탑재한 톤플러스 스튜디오 출시,0
21038,EPL 득점 2위 루카쿠 빅클럽으로 이적할 듯,5
42027,시카고미술관 반 고흐 아를의 침실 재현…하루 10달러짜리도,3
44986,北 김정은 中 휴대전화 사용자 반역자로 처벌 지시,6
2002,민주 총선서 현역의원 전원 경선…여성 가산점 최고 25%종합,6
3682,SKT인텔 영상·음성 통화 가능 사물인터넷 개발,0
42765,SH 마천지구 등 서울 강남권 행복주택 213가구 공급,1
4099,베네수엘라 과이도 귀국시 공항서 영접한 獨대사 추방,4
43859,청년이 제시한 정책 시정에 반영…춘천시 청년청 의제 추진,2
35445,박지수 WNBA 신인 드래프트 지명 후 라스베이거스로 트...,5
8506,축구에 투자한 中 재벌이 사정 칼바람에도 건재한 이유는,5
45334,교사업무 줄인다더니 방역준비 우수사례 모집 나선 교육부,2
39099,교실 앞에 비치된 손 소독제,2
43948,도배 불량 LH 공공주택 하자 신고 가장 많아,2
32810,혼돈의 이라크…총리 사퇴 이어 대통령도 사의,4
39328,신간 원당 조선 왕실의 간절한 기도처,3
29011,신간 읽을 것들은 이토록 쌓여가고·볼리비아 우표,3
