,title,topic_idx
44740,KTH API 스토어 오픈 5주년…유통량 98배 증가,1
4821,네이버 창업·경영 지원공간 파트너스퀘어 서울에 3곳 신설,2
32431,이용자별 취향·필요에 맞게…네이버 맞춤형 AI검색 도입,0
38850,코로나19 재확진 청주 4세 아동과 접촉 주민 등 5명 자가격리종합,2
44673,만화박물관 3·1운동 기념벽화 걸고 영화 동주 무료상영,3
19055,동아일보 앞 조선·동아일보 규탄 회견,2
35927,우주관광 실현 한발 더…아마존CEO 우주선 비상탈출 실험 성공,0
9692,문 대통령 만남의 불씨를 횃불로…김여정 꼭 평양 오세요종합,6
15432,트럼프 멕시코 장벽설치 비용 안내면 이민자 송금 차단해야,4
22175,게시판 금투협 해외 ETF·대체투자 이해 교육과정,1
19704,일본인 부부과학자 미세운동 관련 뇌속 신호유지 과정 찾아종합,0
30153,그래픽 축구선수 수입 순위 톱10,5
40391,임대료 전액 감면…호서대 착한 임대인 운동 동참,2
28749,2보 ECB 금리 동결…물가목표 근접까지 현재나 더 낮은 수준 유지,1
26875,경기 가평 오후 11시 한파주의보…11일 영하 10도,3
11923,펜스 美부통령 대만과 단교한 솔로몬제도 총리와 만남 거부,4
851,한국 AI스피커 시장 급성장…올해 세계 톱5 전망,0
9575,MLB 피츠버그 바스케스 미성년자 불법 성관계 혐의로 체포,5
22277,애플이 아이패드에 공을 들이는 이유는,0
30391,회동하는 3당 원내대표,6
32315,날씨 6일 전국 흐리고 비…태풍 영향권 제주·남해안 강풍,3
19813,작년 하반기 네이버 상대 압수영장 요청↓·제공정보↑,2
30182,LG V30S ThingQ AI가 최적의 촬영모드 추천,0
15131,작지만 큰 울림으로…전북 마을 미디어 네트워크 창립,2
14774,PSG 이적 네이마르의 심경 고백 선수는 도전이 필요,5
24849,텔루스 자회사 디오스텍 합병 결정,1
34305,LGU 카카오리틀프렌즈폰 출시…위치조회 시 카메라 작동,0
29847,원자력 RD 방향 경제성장→안전중심 전환,1
16300,갤노트10 9일부터 국내 사전판매…124만8천500원부터,0
25471,우즈베크 감독 한국 조직력·압박 좋았다…많이 밀린 경기,5
5913,확대간부회의 참석하는 이해찬,6
44931,내년 표준 단독주택 공시가 6.68% 오른다…서울은 10.13% 껑충,1
16585,게시판 광주세계수영대회 KT ICT관에 10일간 1만8천명 방문,5
22039,롯데 인도서 스타트업 경진대회…3개사 선발해 5천700만원 상금,1
43215,신뢰란 선악의 문제 아닌 이익의 균형점 찾는 문제,3
45254,마이너리그 7년 문찬종 친구 최지만의 격려 받고 왔죠,5
16973,주말 N 여행 수도권 300ｍ 길이 무료 봅슬레이…광화문서 만나는 평창올림픽,3
11961,크리스 세일 7년 연속 200탈삼진 돌파…MLB 역대 5번째,5
30405,기관 투자자들 옛 대우증권 팔고 미래에셋증권 주식 샀다,1
12385,구글코리아 온라인 무료 코딩수업 코딩 야학 프로젝트 실시,0
17791,약물전달 생체분자 구조변화 과정 밝혔다…신약개발 기여 전망,0
7168,여자배구 드림팀 5일 태국과 대결…1승 1패 한국 이...,5
33137,정의장·여야 원내대표 만찬… 추경처리 시기 논의,6
37640,혈액 만드는 조혈줄기세포 제작법 개발,0
14664,골든스테이트휴스턴 NBA 서부콘퍼런스 결승 맞대결,5
1727,국내 웹호스팅 업체 랜섬웨어 감염…추가 피해 우려,0
7829,재건축 조합원의 반발 관리처분인가 단지 상한제 제외해달라,2
38930,권력기관 개혁 관련 언론 브리핑 입장하는 추미애박지원진영,6
11582,삼성바이오 논란 금융당국 책임 국민청원 잇따라종합,1
23562,中·러 미사일 사드 공격하면 질문에 한민구 당연히 요격,6
27343,카카오 22일에 카뱅 최대주주 된다…첫 산업자본 은행 주인종합,1
30840,5G 시대 열렸다…개인 고객은 내년 3월부터,0
3467,인도 여신도 성폭행 종교인 이번엔 언론인살해 유죄선고 받아,4
28274,K리그1 제주강원 무승부…제주 14경기·강원 5경기 무승,5
31259,KGC인삼공사 알레나 부상 속 4연패 탈출…현대건설 10연패,5
37664,제33회 부산교육대상 수상자들,2
23391,시티건설 역삼동 시티프라디움 더 강남 이달 말 분양,1
29435,언론노조 대위원회 참석한 권영길,2
34776,재판중 사망 이집트 무르시 전 대통령 구금생활 잔혹종합,4
24008,한국당 새해 단배식 처음부터 끝까지 지방선거 필승,6
20710,현대종합상사 작년 연결 영업이익 234억원…20%↓,1
29719,일상공간서 즐기는 문화가 있는날…금주 전국 2천439개 행사,3
43017,김경린·오장환·문익환…탄생 100주년 문인들 돌아본다,3
25410,여야 재난에 폭염 포함해야…재난법 개정안 잇따라,6
6846,게시판 창립 10주년 인터넷진흥원 미래위원회 발족,2
19234,올림픽 태극기 흔들며 입항 반대,2
41155,4월6일 개학할수 있을까 원격수업 시연,2
15534,수비 비중 커진 송명근 내 배구 인생에 도움 되는 시기,5
36419,배당 많이 푼 우선주 주가도 쑥쑥,1
32698,손님이 불편 경찰관 쫓아낸 美스타벅스 논란 일자 사과,4
7299,애플 국내서도 아이폰 보상판매…아이폰XR 69만원부터,0
7615,조배숙 대표 625 참전 용사들 문제 해결에 최선을 다하겠다,2
44785,美 백인 경찰 과속단속 중 흑인 여교사 땅바닥에 내동댕이,4
16729,與 檢 계엄령 문건·패스트트랙 신속 수사하라…한국당 압박,6
32006,홍보대사·재단 이사장 이승엽 야구장 가고 싶어요,5
20480,MLB 사무국의 노력…미국서 야구하는 아이들 다시 늘었다,5
559,컴퓨터에 매달린 아들 나무라는 아버지…호주 가정의 비극,4
34821,필리핀도 액상형 전자담배 전면금지 추진,4
16186,우린 두렵지 않다…FC바르셀로나 테러 희생자 추모,5
1023,미 F22 전투기 편대 카타르에 첫 배치…이란 압박,4
41106,안양지역 기관·단체 교통사고 사망률 제로화 추진,2
37890,대북전단 박상학 집 찾아온 취재진 테러 공모 혐의로 고소,6
7385,마카오 카지노 수입 21개월째 감소…0.1%↓,4
24120,日서 임신·출산 국회의원 원격투표 허용 여부 논란,4
5751,해운대 물총 피서,3
28151,WKBL 제8대 총재에 이병완 전 청와대 비서실장종합,6
45280,순교자 이승훈 배신자 정약용에게 신앙을 묻다,3
39740,전남도내 직업계 고교 학과개편 등 체질 개선한다,2
7512,종교극단주의 반대 파키스탄 저명 인권운동가 탈레반에 피살,4
25823,춘천 남이섬서 15일 교향곡 아버지 하이든 공연,3
25997,스위스 병원 입원했던 알제리 부테플리카 대통령 귀국종합,4
38571,모멘트 맑게 갠 하늘 아래 전교조 만세삼창,3
33145,신간 아기 말고 내 몸이 궁금해서·넷플릭스의 시대,3
45187,경남교육청 올해 자율형 종합감사 학교 332곳으로 확대,2
35435,그래픽 토지보상 예정 주택지구,1
305,늪에 빠진 트럼프…공화당 주류 외면에 지지율 추락 이중고종합,4
13325,캐나다 화웨이 갈등에 대중국 농산물 수출 타격,4
30367,LG유플러스 제휴 알뜰폰에 아이폰6 32GB 공급…실구매가 0원,0
42048,연극인복지재단 신임 이사장에 연극배우 윤석화,3
26052,최지만 대타로 나와 2타수 1안타…추격의 적시타,5
14763,국고채 금리 20년 이상물 빼고는 소폭 하락,1
37223,증시신상품 BNK운용 삼성전자중소형주 펀드,1
28900,대타 박건우 역전 2타점 3루타…두산 LG전 10연승,5
15819,한국인 과학자들 시간 결정 구현 성공…네이처 표지논문종합,0
18305,남녀동반 올림픽 꿈꾸는 배구대표팀…예선 전략은,5
18170,북 수소탄실험 軍 예측못한 듯…뒤늦게 상황파악 중,6
28830,WFP 짐바브웨 사이클론 피해 이재민 20만명 넘어,4
1599,軍 美대선 앞두고 北 무수단 발사 대비해 감시 강화,4
13808,황우석 사태 박기영 혁신본부장 임명에 과기인단체 반대,2
13233,예술을 품은 인천공항…제2터미널서 경험하는 감각의 비상,2
2689,22안타 KIA 두산 5연승 저지…로저스 친정 한화에 완투승,5
6532,IOC 리우올림픽 기간에 대통령 탄핵안 표결 피해달라,4
4011,비핵화 접점 찾아가는 남북미…靑 진지한 분위기 기대감,6
21556,SNS돋보기 20대 23% 가상화폐 구매 경험…생각보다 많네 씁쓸,1
19974,美민주 유력주자 바이든 3분기 선거자금 모금액은 3위 그쳐,4
11616,시즌 첫 골 손흥민 모든 상황 준비해 좋은 결과로 이어졌다,5
23971,굶어죽지 않으면 다행…그래도 책방 하는 이유,2
38861,수도권 전철 금천구청역 복합역사 개발 사업자 공모,2
961,靑 北 장거리 미사일 발사 징후 우선순위 두고 감시,6
15894,공식운동 첫 주말…부산 與 축제장 vs 野 거리유세,3
3752,네이버 AI 검색 주력은 이미지·자연어·자동추천종합,0
24688,인터넷 신냉전…푸틴 러시아판 위키피디아 제작 지시,4
5729,쪽무이 그림부터 태양상까지…북한미술의 다채로운 얼굴,3
11633,고춧가루 팍팍 KB손해보험 현대캐피탈까지 잡았다,5
13705,게시판 KT 1등 워크숍 성과공유회 개최,2
32329,국회법 공방 격화…與 국정 마비 野 섣부른 판단,6
9984,주말 N 여행 제주권 관악 선율 온 섬을 뒤덮다…26개국 연주자 영혼의 고백,3
44953,경남도KBS창원방송총국 재난대응 협력 협약,2
14478,이상민 감독 등번호 KCC 이어 삼성서 영구결번 지정,5
18477,페이스북 개인정보 유출 한국 피해자 최대 8만6천명종합,0
36864,언중위 불공정 지방선거 보도 91건 제재,2
37843,내일날씨 맑다가 오후부터 흐려져…제주 밤비 살짝,3
3337,브렉시트 우려 탓…닛산 英 투자계획 철회 움직임,1
4464,이라크서 새해 첫날 유람선 침몰…관광객 90명 이상 사망종합3보,4
4226,靑 朴대통령 총리에 권한 드렸다…김병준 국정 주도,6
45351,ETRI 민감도 20배 높인 압력 센서 개발,0
45463,금융위 카드사 레버리지 한도 6배→8배로 완화,1
27784,朴대통령 동물 아니면 식물국회…진실한 사람이 국회로,6
13622,발언하는 주광덕,6
5509,푸틴 방러 시진핑과 정상회담…러中 한반도 정세 평가 일치종합,4
35661,특징주 삼성증권 나흘째 약세…하락 폭은 둔화종합,1
39480,지존 하반기 토지보상 투자전략 무료세미나,1
38430,행주산성역사누리길 온 가족이 걷는 나들이길에 선정,3
31813,38세 베테랑 센터 정대영·김세영 여전히 견고한 벽,5
18501,충청권 온라인 신문사 뉴스 TT 창간,2
7936,문대통령 경제성과 체감이 목표…개천서 용나오는 사회 만들자종합,6
11071,한투증권 삼성물산 4분기 실적 무난…주가 바닥 통과,1
23335,프랑스 마크롱 이집트 안정 인권과 분리될 수 없어,4
44743,2천500년간의 서양 정치철학 정리한 역작…정치사상사 출간,3
39976,신산업·기초학문 석·박사 인재 기른다…7년간 2조9천억 투입,0
21574,16만명 개인정보 유출 이스트소프트에 과징금 1억·시정명령,2
11099,방통대 조교 4년 넘게는 못해…인권위 권고 거부,2
4687,갤S8 출시 첫 주말 이통시장 정중동…개통 지연종합,0
17440,미·중 무역갈등 해소 기대에 원달러 하락 마감…1123원대,4
28307,프로야구 SK 2018 캐치프레이즈 다 함께 더 높이,5
44817,코스피 기관·외국인 매도에 하락 출발…1840대로 밀려종합,1
14391,국민의당 계좌 확인하며 리베이트 의혹 진상조사 속도,6
32890,한컴MDS 지능형 전시 안내 로봇 공개,0
10643,신간 거울 사원·너의 알다가도 모를 마음,3
10089,손흥민 풀타임케인 해트트릭 토트넘 아포엘에 30 ...,5
12219,SKT 5G 상용망 구축 현황 공개,0
34215,없어서 못 판다…아이폰X 출시 첫날부터 물량 부족종합,0
42052,270만 영세·중소 카드가맹점에 수수료 우대…580억원 환급,1
20716,불법스팸 전송 이력 있으면 유선전화도 신규가입 안된다,0
18608,北 사이버 공작 대비 사이버 계엄령 발동 근거 필요종합,6
24946,드래프트 1번 유력 이대은 올해 최고 구속은 151㎞,5
35546,여자 3대3 농구 국제대회 1314일 고양에서 개최,5
22588,6·25 앞둔 여야 지도부 北도발 대응 안보 행보,6
36628,경영계 한일 기업인 입국제한 완화 환영…협력확대 계기 돼야,1
26661,미국 SI 류현진 목욕물 온도까지 분석…믿기 힘든 훈련...,5
41142,전세난 풍선효과에 전국 집값 들썩…4개월만에 최고 상승,1
45437,박범계 엘시티 비리 키맨 이영복 수행비서 장민우 구속돼,2
31598,국산 AI기술 최다 적용 분야는 금융…고객·민원상담용,0
37563,개회사 하는 김춘식 한국언론학회장,2
25953,포지선별 선수 동작도 본다…U 프로야구 서비스 새단장종합,5
1022,막말 트럼프 돌풍에 미군 퇴역 장성들 대선 개입도 두드러져,4
36305,美 수배받은 콜롬비아 최대 반군 전 사령관 의원으로 취임,4
39639,강원FC 함석민 음주운전 사고로 60일 출전정지 당해,5
37424,게시판 KBS경제인문사회연구회 사회변화 공동대응 협약,2
26002,국내 장단기 금리차도 2년여만에 최소…경기 우려 반영,1
37766,팅크웨어 81억원 규모 자사주 처분 결정,1
11687,국제과학기술경진대회서 본상 받은 한국 고교생들,2
6436,트럼프·시진핑 오사카서 역사적 무역담판 돌입종합2보,4
41089,글로벌X 클라우드 컴퓨팅 ETF 순자산 1조원 돌파,0
26729,문선민 2골 인천 절대 1강 전북에 32 격파…시즌...,5
31889,최지만 필라델피아전 3타수 1안타…시범경기 타율 0.375,5
445,中공안부장 4중전회 후 정치·사회적 안정 강조,4
33518,또 체면 구긴 바르사…메시 막판 골로 진땀 무승부,5
21717,NBA 토론토 르브론 제임스의 클리블랜드에 34점 차 대...,5
19575,이정미 허익범 특검 드루킹에 휘둘려…본연 임무 망각,6
33142,SKT 푹·플로 앤 데이터 출시…3개월간 월 100원,0
5683,에티오피아서 취약종 하마 최소 28마리 떼죽음…원인 불명,4
20004,지원금 상한제 폐지 한달 ① 소비자 혜택은 없었다,1
21387,잔금 치르고 입주 마쳤는데 소유권 이전 안된다니,1
41660,경상일보 언양읍성 민속놀이마당 개최…체험행사 가득,3
8708,거리에서 노래하던 베네수엘라 이민자에게 찾아온 기적,3
27954,백두산 아래 서울시 면적 2배 마그마 존재 가능성,0
2210,1등 아니면 꼴찌…2팀이 경쟁하는 세상에서 가장 작은 축구리그,5
22949,인천 서해 5도로 호우주의보 확대…백령도 52.5mm종합,3
32198,드론 출현에 30분간 공항 마비…獨프랑크푸르트서 운항 중단,4
17208,파일 암호화에 개인정보 유출까지…스톱 랜섬웨어 주의보,0
10762,맨유 유럽 챔스리그서 벤피카 20으로 제압…4연승 행진,5
17891,2보 코스피 하락 출발 후 상승…장중 2080선 회복,1
34151,민주당 서울시장 면접,6
8060,그래픽 GDP 대비 가계부채 증감 상위 10개국,1
30590,터키 동부 호수에서 난민 71명 탄 보트 전복…7명 사망,4
35313,IT업계 연초부터 MA 바람…타깃은 미디어·콘텐츠,0
8208,퇴진 요구받은 수단 대통령 시위로 정부 안 바뀐다,4
43199,LH 공공임대주택 유형 통합 시범단지 설계 공모,2
39888,신영와코루 작년 영업익 7억5천만원…87.4% 감소,1
41158,몰래 의자 뒤로 빼 동료 엉덩방아 찧게 한 60대 벌금형,2
31933,유일호 금융·공공기관 파업 해도 너무한 집단 이기주의,2
30599,터키 국방 쿠르드 민병대 예정대로 철수 중,4
7112,하이투자 대외 불확실성 커지면 성장률 1%대 가능성,1
44490,60여차례 어린이 학대한 50대 전직 어린이집 교사 검찰송치,2
39848,그래픽 주요국 4월 자동차수요 증감률,1
19430,국내 주식형 펀드에 나흘째 자금 순유입,1
33046,사우디 축구대표팀 이례적으로 팔레스타인 지역서 경기종합,4
42276,캐나다 건국 150주년 퀘벡주 여름축제 풍성,4
3370,신명나는 덕수궁 정오 음악회,3
19845,양심적 병역거부자 대체복무 허용…포항지진특별법도 통과,2
30222,이스라엘 정보당국 팔레스타인인 50명 테러 혐의로 체포,4
6825,여자농구 삼성생명 KB까지 대파…파죽의 5연승,5
39128,류현진이 지쳤다 의심의 눈초리 보내는 현지 매체들,5
19727,3野 장외투쟁 전방위 압박공세…내부 자충수 우려도,6
27439,모바일 HDR 프리미엄 규격 확정…갤S8 인증 받을 듯,0
37167,브렉시트 실행되면 이중다수결제도 여파로 獨비토권 약화,4
43032,주말 N 여행 가는 겨울이 아쉽다…막바지 빙어氷魚 낚시의 묘법,3
39262,이사장 잇단 중도퇴진·임직원 비리…과학창의재단 혁신 나선다,2
23863,박항서호 베트남 무패·무실점 조 1위로 스즈키컵 준결승행,5
22225,과테말라 대선서 前 영부인 토레스 선두…8월 결선투표,4
38357,K리그 레드카드 속출…VAR은 못속여,5
6709,15년 기다린 지메르만의 내한…최상급 보석처럼 빛을 발한 음색,3
37068,충북시민단체 CJB 이재학 PD 사태 해결까지 투쟁,2
11988,오보에 샛별 함경 RCO 나와 핀란드 방송교향악단 갑니다,3
19101,가스공사 엑손모빌 등과 기술교류 워크숍 개최,0
17834,하나금투 JYP엔터 신인 데뷔·주주가치 제고 매력적,1
16214,아프리카 수단 공장서 폭발후 화재…최소 23명 사망종합,4
38959,만화로 보는 학생 항일운동…청주교육지원청 웹툰 제작 눈길,2
5543,홍콩 시민단체의 중국인 관광객 반대 시위를 보도한 SCMP,4
41720,갤노트7 단종 후 첫 사장단회의…사장단 침묵,0
23393,광주교육청 지방공무원 임용 합격자 발표…여성 68.7%,2
10910,북한접경 中상인들 한반도위기 결국 사라질 것…투자준비,6
6189,판문점 선언 대담·긴장·여유·감성…김정은의 다양한 얼굴종합2보,6
29102,내주날씨 6일 전국에 비…기온 평년 웃돌 듯,3
26188,메르켈 메이 英 새총리에 EU에 원하는 관계 분명히 해야,4
26621,힐러리 워싱턴DC 경선 승리…열전 135일 대미 장식,4
33989,NH농협 코스피200지수 연동예금 출시…최고 연 4.15% 수익,1
25949,北김정은 사회주의 위업완성의 새로운 이정표…당대회 개회사3보,6
13677,게시판 KT 볼베어파크에 에어맵코리아 플랫폼 구축,0
32886,한국도로공사 현대건설 완파…정규시즌 우승까지 승점 3,5
1471,NBA 보스턴 시카고에 팀 최다 기록 56점 차 완승...,5
42256,모멘트 기아차 부분파업 4시간 단축근무,2
15545,연구실 책임자 위험요인 분석·대책수립 의무화,0
4566,러시아行 23인에 들어라…태극전사들의 마지막 오디션,5
14329,남북정상회담역사적인 순간 지켜보는 더불어민주당,6
34282,동남권 상장사 실적 분석했더니…전형적 불황형 흑자,1
22522,김세진 OK저축은행 감독 PS 가려면 10경기에서 8승은...,5
25323,대통령개헌안 ⑥토지공개념 명시…개발이익환수·부동산과세 강화 전망종합,6
29592,민주 한국당 국감에서 소모적 정쟁만…정치혐오 부추겨,6
14342,솔로몬제도 총리 대만 단교·중국 수교 검토…도미노 가능성,4
4098,네이버 통·번역 앱 파파고 월간 사용자 1천만 돌파,0
31067,올해 과학기술·ICT 분야 RD에 4조3천억원 투입,0
22169,아베 일본 100년전 식민지주의 맞서 인종평등 주창 궤변종합,4
17344,마다가스카르 국립대에 한국문화코너 개관…한류 효과,4
42112,국민의당 정호준 합류로 교섭단체 구성…보조금 46억 더 확보종합,6
9448,양파껍질 같은 아베식 벚꽃놀이 의혹…日여론 악화일로,4
17741,25개국 신인모델 한자리에…2224일 아시아 모델 페스티벌,3
33793,국토부·LH 도시재생 분야 첫 임팩트 투자펀드 조성,1
24012,러시아 국방 쿠르드軍 안전지대서 예정보다 빨리 철수,4
35015,美 이란 핵합의 탈퇴 1년…살얼음판 걷는 합의 이행,4
8493,추미애 당내 통합 행보…호남 전통적 지지층에 구애,6
10852,경청하랬더니…국민의당 무책임한 제안말라 시민단체 호통,6
43233,거가대로 천성IC 부근 차량 추돌사고로 3명 중경상,2
38146,세계 경제 위기 속 글로벌 기업들이 한국을 주목하는 이유,4
45401,해커 먹잇감 된 오픈소스 SW…가상화폐 채굴에 악용,0
27818,창조경제 성과 나눠요…창조경제혁신센터 페스티벌,1
4724,美 제재 첫달 이란EU 교역액 3분의 1로 감소,4
24672,北 노동신문 대북제재 이후 공격적 어휘 사용 늘어,6
11751,농구장에서 새해맞이…31일 밤 11시 LG kt 격돌,5
25857,게시판 한국언론학회 봄 정기학술대회,2
13125,北 김정은 잇단 민생행보…이번엔 비누공장 방문,6
20183,캠코 아파트·주택 등 압류재산 653건 공매,1
38083,대신증권 롯데푸드 1Q 실적 기대 웃돌 전망…투자의견↑,1
42439,주말유세 격돌…제주 후보들 축제·오일장 돌며 지지 호소,3
38098,근로자·사업주·청소년 교육기관 한국고용노동교육원 출범,2
25689,롯데 차세대 CEO 후보군 대거 발탁…황각규 부회장 승진,1
42697,동정 김문오 대구 달성군수 대경언론상 특별상,2
33775,국고채 금리 일제히 하락…3년물 연 1.968%,1
35608,신간 조선 리더십 경영·태양은 아침에 뜨는 별이다,3
4684,혹시나 했더니 역시나…또 불발된 제4이통,0
36923,윤지오 머투 洪회장 꽃배달 덮으려 몇십가지 거짓말,2
14562,KIST 뉴로바이오젠과 기술이전·연구협력 협약,0
3053,생물올림피아드서 한국대표전원 금메달…중국·헝가리와 공동1위,0
36987,게시판 교보문고 광화문점 조각가 구본주 전시회,3
6797,소설가 한강 25일 연세대서 특별강연,3
16890,AS로마 토티 구단 프런트 제의에 은퇴 여부 고민 중,5
20371,美대선 TV토론 판정승 힐러리 부동층 흡수할까…초박빙 판세 변화 주목종합,4
44899,교육연구정보원 코로나19 이후 교육의 변화 웹세미나 개최,2
9800,수심 6천500ｍ 탐사하는 심해유인잠수정 개발 추진,0
16436,대만·차이잉원 中 웨이보서 검색 차단,4
32771,한국 여자배구 전력 변화 없이 VNL 보령시리즈 출격,5
27643,미국 공화당서 힐러리 기소 주장 본격 제기,4
25045,중부 장맛비·남부 소나기…낮 최고 36도 폭염 계속,3
7297,취임 3주년 朴대통령 일자리 창출 창조경제 거점 방문,6
2408,게시판 하나금융투자 19일 하반기 투자설명회,1
1935,MLB 시애틀 입단 기쿠치 최대 7년 총액 1억900만달러,5
13090,경제행보 朴대통령 총선 닷새앞 격전지 청주·전주 방문종합,6
9792,中 아프리카 공들이기 가속…20조원 합작사업 합의,4
9233,박항서 서로 도움 되는 경기…北 김영준 박 뛰어난 감독,5
23174,트럼프 크루즈루비오 단일후보 못이겨…단일화 최대 변수로,4
12947,민앤지 인터넷에코어워드 통신서비스 분야 대상,2
9948,박민정 페미니즘 작가로 호명되기…기쁜 일이죠,3
625,제임스 버저비터…클리블랜드 토론토 상대 PO 9연승,5
34774,무용극 하늘연인…정읍 예가인서 28일 개막,3
2062,바이올린 영재 강나경 영 차이콥스키 콩쿠르 공동 1위,3
1145,그래픽 인터넷 이용자 SNS 이용률,0
39677,피아니스트 키신 티켓 파워 화제…2분만에 전석 매진,3
37497,특고·자영업자 지원금에 노동부 전 직원 투입…한달 내 지급,2
32419,日언론 이란 아베에 원유금수 중단 요구 트럼프에 전달 요청,4
40873,국감현장 민병두 비서관 특채 논란에 정무위 한때 파행,6
44568,서울대 연구팀 액체상에서 이온 분리 메커니즘 증명,0
15324,아이폰 X 이번엔 콜드게이트…애플 업데이트하겠다,0
24691,갤노트7·아이폰7·V20…프리미엄 스마트폰 다시 뜬다,0
6502,날씨 수도권 미세먼지·오존 나쁨…낮최고 24∼33도31일,3
15394,美DNI 국장대행 백악관이 의회 증언 방해하면 사임할 것,4
14382,난민 입항 막던 伊극우 부총리 미성년자 27명 상륙 동의,4
12684,저비용항공사들 부산∼괌 노선 쟁탈전 점입가경,2
31788,NBA 샌안토니오 두 경기 연속 30점 차 완패…이럴 수가,5
27652,고용 유지하는 소상공인·中企에 저금리 대출,1
16499,대규모 괭생이모자반 덩어리 제주·서해안 유입 비상,2
24098,서울 대출금지 15억원 초과 아파트 15.5%…강남 3구에 집중,1
23139,제조업·ICT 산업분야 AI융합에 초점 맞춘 차별화 전략필요,0
37533,한동훈 유시민 전담 취재 언급에 그건 해볼 만하지종합2보,6
12212,김정은 위원장 남북통일농구 혼합경기 관람할까,5
31185,알파고의 진화 인간고수 덕…이세돌 초읽기 약점도 사라졌다종합,0
