,title,topic_idx
37465,반월·시화산단 근로자 사망사고 잇따라…고용부 감독 강화,2
22911,북중접경 시찰한 김정은 질책한 공장들 쏙 빼고 선물 보내,6
12830,속보 아베 트럼프와 한일관계 논의 안했다,6
19969,대신자산신탁 등 6곳 금투협 정회원 가입,1
8169,의장석 점거·몸싸움·욕설까지…동물국회 재연 아수라장 국회종합3보,2
3614,표 朴대통령 멕시코 방문 계기 체결된 MOU 34건,6
3384,EU 이탈리아 과도한 채무·저성장·고실업으로 도전 직면,4
19456,우크라 대선 결선투표 후보들 마약 검사까지 받으며 건강 과시,4
42799,화천산천어축제 즐거운 눈썰매,3
32258,국회 교문위 망언 파문 나향욱 출석 문제 놓고 파행,6
38404,패션지보다 SNS가 위험한 이유…나르시시즘 길들이기,2
37945,신문협회 SBS 8뉴스 PCM은 사실상 중간광고…즉각 규제해야,2
12088,납품업자 TV홈쇼핑으로부터 사전제작 영상물 사용료 받는다,2
32139,터키 정부 親쿠르드 야당 소속 민선시장 또 해임,4
1411,최고위원회의 참석하는 이해찬과 이인영,6
20629,한화 작년 영업익 2조1천300억원…600원씩 배당종합2보,1
11210,한국경제 길을 묻다 ③ 혁신적 벤처기업 전성시대 온다,1
20789,선관위 내일 4·13 총선 사전투표 첫 모의시험 실시,6
43943,마스크 쓰고 기다리는 응시생들,2
39622,호주 여당 시드니 코리안가든 사업 100만달러 지원 총선 공약,4
32845,펠리페·나경복 46점 합작 우리카드 대역전승으로 단독 1위,5
21853,STC 324억원 규모 공랭식 열교환기 공급계약,1
27989,아르헨티나 금융시장 복귀 순항…하원 채무상환 승인,4
44355,구멍 뚫린 BMW 흡기장치,0
27970,인공지능 컴퓨터 마침내 프로 바둑기사를 이기다,0
39725,충북도시·군 미취업 청년 5천명에 구직활동비 30만원씩 지원,2
7260,전시를 기념하는 KT 임직원들,2
30870,유진투자 中 자동차 내수 부양책에 韓부품업체 수혜,1
15163,아모레퍼시픽 말레이시아 생산법인 설립에 1천100억 출자,1
44376,靑 감찰서 유재수 비리확인 檢발표 반박…텔레그램방 없었다종합,6
2478,조용중 전 연합뉴스 사장 별세,2
22691,문 대통령과 군산시장 악수,6
32169,민주 당권주자들 기싸움 최고조…마지막 TV토론서 격돌,6
27387,MLB.com 다저스 3년 연속 WS 유력하지만 우승은 글쎄…,5
41822,SK주유소 실시간 택배 집하시설로 탈바꿈…공유인프라 첫 사례,2
8539,미국폴란드 중동평화 증진 실무그룹 출범,4
14703,與 혁신위 주내 출범…파격 인사 포함해 과반 외부인사로,6
10518,다저스 감독 류현진 직구 제구 좋아…3번째 타순도 잘 공략,5
41993,김정은 앞에만 서면 작아지는 실세들…北 강권정치 어떻길래,6
30414,성난 KIA 야구팬 서울 기아자동차 본사 앞에서 2차 집회,5
1559,온몸 떠는 증세 보인 獨메르켈 총리 괜찮다…건강이상설 일축,4
3911,신한카드 상가 관리비 카드 자동이체 서비스,1
31878,나도 스마트시티 만들어볼까…SKT 여름방학 코딩 캠프,0
31870,신간 답이 보이지 않는 상황을 견디는 힘,3
16664,공공부문 클라우드 컴퓨팅 첫 수요조사…624개 시스템에 도입,0
27889,한국 미술관 제도 초석 놓은 이경성을 회고하다,3
1371,이라크 바그다드서 유혈 반정부 시위 지속…3명 사망,4
23167,평양 도착한 남측예술단,6
16209,진실의힘 인권상에 산업재해 피해가족 단체 다시는,2
33534,삼성전자 갤럭시워치 액티브 그린 색상 출시,0
10971,작년 상장사 외형 커졌지만 이익은 부진…순이익 112조원,1
1433,샤오미 프리미엄폰 미믹스 국내 출시…79만9천원,0
12772,北당대회 北핵·미사일 전문가 실용위성 더 많이 쏴올릴 것,6
24613,잠실5단지 50층 재건축 제동에 매매시장도 급랭종합,1
35675,北 평양 주재 외교사절에 안보리 제재 입장 설명,6
13765,伊구호단체 정부 강경책에도 지중해 해상서 난민 50명 구조,2
10725,플라스틱 맛 본 새끼 물고기 움직임 둔해진다,0
27464,신간 반려동물을 잃은 반려인을 위한 안내서,3
11932,대전서 한·일 핵융합 연구 협력 회의 개최,0
34469,北김정은 대북제재로 주민 희생돼도 핵무기 고수할 것,6
7947,시험은 한국인의 사회적 DNA…한국사회 시험의 1천년 역사,3
2482,이란 사우디 석유시설 공격 英 주장에 무기나 팔지 마라,4
6350,北 무수단 발사 핵 기폭장치·대기권 재진입체 시험 가능성…전문가 진단,6
30753,다저스 감독 류현진의 자신감 좋아한다…그의 꾸준함도,5
14286,북한 朴대통령 북핵외교에 연일 막말 비방,6
20244,한·벨기에 경제인포럼…허창수 4차 산업혁명에서 전략적 협력,1
19670,한국인터넷진흥원 정보보호 연구개발 데이터 공유한다,0
29034,뉴질랜드 이슬람사원 2곳서 총격 참사…최소 30명 사망 추정종합2보,4
13217,최양희 미래부장관 단통법 개정안 의견 경청,6
10705,기쿠치 MLB 시범경기 첫 패전…이치로는 2타수 무안타,5
41823,정의선 현대차·현대모비스 주식 190억원 매입…책임경영 강화종합2보,1
23101,통신비 25% 약정할인 9월 15일 시행…일단 신규 약정자부터종합,1
19357,첫날부터 실전처럼…벤투호 겨울비 속 생존 경쟁 시작,5
44060,100만 체험객 목전에 둔 화천 산천어축제,3
3252,NH투자 현대차 노사협상 타결에 국내공장 정상화,2
42834,초음파로 뇌혈관장벽 열어 뇌에 항암제 전달…치료효과↑,0
23665,중국 지난해 일본에 새로운 안보 관계 구축 제안,4
22488,사진오늘 세계인을 사로잡은 한 마리의 동물,3
41424,오페라계 슈퍼스타 네트렙코 목소리 더 풍성해졌죠,3
41044,위기의 女농구…박찬숙·박정은 이름표부터 달고 다시 뜁니다,5
38729,중국 레임덕 빠진 캐리 람 대신 플랜B 모색하나,4
13313,여야 마지막 임시국회 의사일정·처리안건 집중 조율,6
14535,英 총선 앞둔 노동당 악재…유대교 지도자 반 유대주의 비판,4
4483,네이버 유럽진출 1호 투자기업은 프랑스 음향기술업체,1
5794,카카오 사회적경제 주간 캠페인…댓글 1개당 200원 기부,2
43652,기업은행·국토부 국토교통 분야 중소기업 자금지원 업무협약,1
24328,中학자 北핵실험 또 하면 中 인내 한계,4
39152,충남 노사민정협의회 코로나19 경제·고용위기 극복 협력,2
11629,FC서울 지독한 불운에 눈물…인천과 11 무승부 7경...,5
13943,평양정상회담 평양 떠나는 문 대통령 내외,6
43646,노량진 집단감염에도 내일 임용시험 예정대로…확진자 응시 불가,2
29674,KIA 안치홍·kt 황재균 연장 11회 나란히 끝내기 안타,5
38920,아시안게임 운명의 축구 한일 결승전…상기해야 할 20...,5
40395,농식품부 침체 화훼업계 돕고자 꽃 100만송이 산다,2
42008,서울시 코로나19로 노동권 침해당한 직장맘 지원,2
35820,김종인 더민주 최고 강경파…이정현 단식은 상상초월,6
13919,미쓰비시중공업 앞에서 유인물 나눠주는 일본 시민단체 활동가들,4
17049,제임스 원맨쇼에도…LA 레이커스 개막 후 3연패 수렁종합,5
19936,흐물흐물 투명 물고기 로봇…의료기기 적용 가능성,0
43438,광주교육청 무단 폐쇄 유명 영어유치원 고발 검토,2
39857,월드컵 신태용 안아준 차범근 비난에 흔들리지 마라,5
40054,카메라뉴스 폭염 속 입추 맞은 밤송이와 잠자리,3
11480,올해 프로야구 미스터 올스타 부상은 KIA 세단 더 ...,5
10105,朴대통령 영화관·쇼핑몰서 내수진작 대국민 소통행보,6
27281,인공지능·블록체인·규제혁신…올해 인터넷 10대 이슈,0
40898,이중섭 은지화부터 백남준 다다익선까지…미술품 보존 묘수는,3
473,대통령 개헌안 다음 지방선거와 대선 동시 실시속보,6
19520,최양희 미래부 장관 태국에 창조경제 알려,1
30970,SKT 3D 실사지도로 5G망 설계 고도화,0
15554,네이버에 첫 노조 설립…건강한 성장 위해 노력,2
41420,삼성해고노동자 강제전보 철회하라,2
35208,방성윤 섣불렀던 은퇴 죽고 싶었지만 지금도 늦지 않았다면…,5
31153,북한 남북고위급회담 명단 통보,6
17040,셔저 6이닝 노히트 불꽃투…MLB 워싱턴 NLCS서 쾌조...,5
11221,국고채 금리 일제히 상승…3년물 연 1.430%,1
40998,SKT 추석 당일 데이터 사용 25% 증가할 듯…집중관리,0
21649,네이버 제2 데이터센터 땅 공모에 지자체·민간 등 136곳 몰려,1
14776,네이마르 PK골 바르사 국왕컵 8강 1차전 승리,5
19242,1월 인사 재산공개…임종석 전 靑비서실장 2억2천만원 증가,6
1048,삼성 새 이어폰·워치·밴드도 갤럭시S10과 함께 출격 전망,0
4722,2년만에 돌아온 창작 뮤지컬 아리랑…업그레이드가 중요,3
16811,북한 속살 들여다보니…곳곳에 김정은 우상화 구호,6
21731,DB금융 한샘 매출 증가세 둔화로 정체기 진입…목표가↓,1
32789,코스피 2120대 약세…코스닥은 690대 강보합종합,1
29003,드론 격추에 달아오른 백악관…이란 공격 승인후 취소 막전막후,4
15748,신한금투 작년 1위 PB 직원 선정…고객 수익률 10.6%,1
37964,김해소식 지역공동체 일자리 사업 참여자 모집…25일부터 신청,2
13828,방심위 디지털 성폭력 근절 국제 콘퍼런스 개최,2
7838,일문일답 文대통령 개각…1∼2주 뒤 장관 1명 추가 인사,6
45515,제15회 해킹방어대회 대상에 올가미팀,0
19744,반부패회의 입장하는 법무 장관,2
42958,위클리스마트 여름 밤하늘 수놓는 별똥별 무리 볼 수 있을까…장마 걸림돌,3
13820,류현진 21일 밀워키전서 선발 복귀…90∼100구 예상,5
12033,英 재협상 공세에 EU 합의문 불가·미래관계 가능,4
6037,포그바 부친상으로 토트넘전 결장…맨유 전력 공백 비상,5
32686,항암제 내성 관여 유전자 발견…치료법 개발 기대,0
24116,경기도 30일 자정 대설주의보 모두 해제,3
18072,가장 오래된 인간의 조상 5억4천만년전 생물체 화석 발견,3
363,통일부 北 수해 완전복구 어려워…서둘러 마무리,6
43967,경기도 코로나19 대규모 선별검사센터 운영,2
43451,급식·돌봄 파업에 점심시간 빵·떡…또 아이들 볼모,2
40707,1일 5만원 가족돌봄휴가비 추가 지원 28일부터 신청 접수,1
5965,두산 반슬라이크 1군 복귀…처음보다는 좋아져,5
37141,이주노동자 주거권을 보장하라,2
36794,LG CNS 미래전략사업부장에 백상엽 사장,1
18462,흥겨운 왈츠부터 오페라 갈라까지…신년음악회 풍성,3
384,커리 빠진 골든스테이트 듀랜트·쿡 앞세워 브루클린에 승리,5
30095,강정호 MLB 피츠버그와 끝내 결별 수순…방출 대기 조처,5
37776,北공기부양정 잡는 비궁 로켓 내년 하반기 서북도서 배치,6
25298,토트넘 손흥민 2017년 마지막 경기서 시즌 9호 골 폭발,5
24210,드론·신소재…러시아 과학기술 성과 한눈에,0
7526,젖은 곳에서도 붙였다 뗄 수 있는 인공 문어 빨판,0
32028,삼성전자 갤럭시S8 붉은 화면 제품 불량 아니다,0
24427,카카오 콘텐츠·블록체인 앞세워 해외진출 본격화,1
23221,SNS돋보기 방통위 음란 동영상 유포 단속…범죄 꼭 근절해야,2
4760,국제인권단체들 터키 분쟁지역에 시리아 난민 강제송환,4
45161,퀄컴 모바일용 5G 모뎀 칩세트 이용한 데이터 통신 성공,0
41863,그래픽 전국 코로나19 확진자 현황오후 9시 현재,2
13378,北주도 태권도연맹 프란치스코 교황에 명예9단 수여,6
31771,SNL서 조롱당한 트럼프…나토 학교에서 왕따 학생으로 묘사,4
23701,日서도 새 지폐 인물 놓고 비판론…국가자본주의 상징,4
22496,신간 검은사슴은 이렇게 말했을거다,3
33857,그래픽 삼성 노트 야심작 갤럭시노트8 뉴욕서 공개,0
41051,영동·무주·금산군 전통시장 맛 여행상품 공동 개발,3
29796,유진투자 미국 통상압력 반도체 업황 충격 미미,1
21880,中매체들 北 전술유도무기 훈련에 대미 불만 표출한것종합,4
1303,서울도 벚꽃 개화…7∼8일께 절정 이룰 듯,3
7746,3차전서 위닝샷 SK 김선형 5년 전 아픔 되풀이하기 싫었다,5
43668,신간 메탈리카 백 투 더 프런트,3
13476,브라질 소두증 의심 증가세…230명 감염 5명 사망 확인,4
34826,새로닉스 주당 40원 현금배당 결정,1
17979,선우예권 클래식 스타 탄생…제가 관심 둘 일은 아냐,3
11769,질의 듣는 한인섭 한국형사정책연구원 원장,2
38352,게시판 이달의 KIST인상 4월 수상자 김상경 연구원,0
22951,해군총장 긴장 감도는 서북도서 방문…北 도발시 처절한 응징,6
44517,마카롱 귀 달린 말…동물 향한 애정담은 노준 개인전,3
13374,레스터시티 새 사령탑에 퓌엘 전 사우샘프턴 감독 선임,5
2685,예의 없는 셀카 때문에…체코 해골성당 사진 촬영 제한,4
14654,현대오토에버 28일 코스피시장 신규상장,1
2643,트럼프 힐러리에 더이상 나이스 가이 없다…대공세 예고,4
35079,구글 메일에 AI기술 대폭 적용…자동분류·답장작성,0
45408,역사기행 고구려 역사가 흐르는 오이소·히다카,3
40097,제주시 서부권 학부모 숙원 서부중학교 개교 2∼3년 늦어진다,2
7220,라바리니 여자배구대표팀 감독 러시아 이길 수 있었는데…,5
40899,시진핑의 반부패 캠페인 탄력…前 윈난성 당서기도 자수,4
43401,정세균 총리 집중호우 피해 현장 점검,6
36008,도로공사 세터 이효희 지금은 무조건 뛰어야 할 때,5
6668,KB운용 해외부동산운용본부 신설…새 투자처 발굴,1
39015,대우조선 노르웨이 씨탱커스서 LNG운반선 1척 수주,1
9438,하이트진로 더벤처스와 서초사옥에 공유 오피스 개설,1
42509,목포항에 해경 전용부두 부잔교 설치…2018년 준공,2
24154,北 국가가격위원회 위원장 교체…량의경→최강,6
7920,中 훈춘에 나진항 연결할 국제버스터미널 착공,4
28317,한국투자 아모레G 고성장 지속…매수,1
19416,네번째 생일 맞은 英 샬럿 공주 엄마 카메라 앞에서 활짝,4
36880,HSK 시험장 신종코로나 바이러스 예방 철저히,2
9668,EU 융커 차기 집행위원장 후보 추천과정 투명하지 않았다,2
10775,美 러시아 美대선 개입 위해 민주당 해킹…러 강력 부인종합3보,4
20552,그래픽 고고도 미사일방어체계 사드THAAD 개요,6
21626,이총리 방일 위해 출국…2박3일 한일 디딤돌 외교 나선다,6
10812,베트남 VNA통신 연합뉴스의 평창올림픽 뉴스 공유망 가입,4
2549,이란서 애국 강조 국민MC 캐나다서 원정출산 의혹 거센 비판,4
41063,렉서스 작년 글로벌 시장서 65만2천대 판매,1
41789,김윤기·김재홍 IBK기업은행 신임 부행장,2
35256,터키 북키프로스에 무인기 배치…동지중해 긴장 고조,4
24705,알제리서 공연장 압사사고로 5명 사망…문화장관 사임,4
13971,주한미군 군무원 불륜 보도 기자 벌금형…불륜은 사적 영역,4
18176,맨유 맨시티에 20 완승…루카쿠·래시퍼드 연속골,5
16540,유혈참사로 혼돈의 수단…군부 9개월내 대선 야권은 거부종합,4
27395,이집트대박물관 근처서 폭탄 터져…관광버스 탑승자 17명 부상,4
24785,아랍연맹 팔레스타인에 자금 지원키로…월 1천100억원 규모,4
23121,예보 정확도 높인다…기상위성 천리안 2A호 오늘 우주로,0
29748,국내 첫 대규모 개인전 데이비드 호크니,3
40068,염상섭·현진건·김기진…함께 쓴 연작소설 황원행 복원,3
26631,황창규 경영고문 자문료 몰랐다…차기회장 선임 관여 안해종합,2
31957,눈 내린 화순 만연사,3
34243,다치고 부진하고…이중고 시달리는 디펜딩 챔프 KIA,5
44630,AR두들 등 갤노트10 최신 기능 S10에서도 이용하세요,0
23641,과기부 1년간 12개 RD 사업 예타 통과…사업비 3조8천억원,2
1385,佛 아프리카 식민지배 계속 伊 부총리 주장에 佛 발끈,4
35572,LTE 드론으로 실시간 사고 감시 SKT 영상재난구조 시스템,0
18093,인천 강화도 10월 가을 축제 풍성,3
7382,페이코 신용관리 출시…횟수 제한없이 신용등급 무료조회,1
39832,이마트 2분기 영업손실 474억원…적자 확대,1
10264,인삼공사 김승기 감독 30점 차 대승 선수들 정신력이 ...,5
28007,이란 외무 5월 26일에도 美 무인기 영공 침범,4
6611,NHN 기업 클라우드 시장 본격 공략…美·日도 진출종합,4
34109,조선말 대중문화 태동부터 한류까지…대중문화예술의 역사,3
20773,파키스탄 인도와 갈등 해소 나서나…테러범 사법처리 움직임,4
9310,LGU 아파트단지에 공기 질 측정기 설치,2
20168,기로에 선 손학규…사면초가 속 이번주 정면돌파 승부수,6
32279,래시퍼드 결승골 맨유 유로파 4강 1차전 10 승리,5
7050,LG 스마트폰사업 대대적으로 손본다…넛크래커 탈출시도,0
21361,北최선희 국제회의 참석차 스웨덴행…북미접촉 가능성종합3보,6
32359,추신수 132ｍ짜리 대형 투런포…시즌 6호·통산 195호...,5
4023,이란 핵합의 제한 우라늄 농축도 넘겨…20% 농축도 가능,4
366,미군 쿠르드군과 시리아 북부 순찰…철수 뒤 처음,4
34504,총선 D1 조윤선 대구 경합지역 찾아 막판 지원유세,6
15297,첫 주거종합계획 발표…사람답게 사는 집 상반기 고시종합,1
25342,한국 5G폰 도입률 초기 세계 선두…2020년 10% 예상,2
16236,KT 스마트폰 배터리 절감 기술 효과 확인…평균 38% 줄어,0
23491,신문의날 기념세미나…신문 지원 민주주의 펀드 필요,2
13894,공영방송 뉴스타파 기자 영입경쟁…반응은 극과 극,2
25329,메르켈 美의 국방비 증액압박에 GDP 2% 향해 갈 것,4
19929,朴대통령 비핵화 없는 北의 대화제의 국면전환 위한 기만,6
6520,이정현 대통령과 수시로 통화하고 필요시 면담 신청할 것속보,6
13932,올림픽 평창에서 만난 문 대통령과 북한 김영남 최고인민회의 상임위원장,6
4459,김무성·이한구 공관위원장 최고위 출석 놓고 또 설전,6
26309,게시판 농협은행 스마트뱅킹 신규가입 이벤트,2
31656,러시아 대사 푸틴 대통령 中 일대일로 정상포럼 참석 확인,4
45272,연 20% 이상 고리대출자 대상 17%대 햇살론 9월에 나온다,1
22765,삼성 갤S9 새 색상으로 붐업…판매 증대에 안간힘,0
12102,프로농구 D리그 29일 시작…현대모비스DB 개막전 맞대결,5
32340,프로축구 수원 조나탄 톈진 이적 공식 발표,5
45407,LG전자 임직원 찾아가는 수해복구,2
3836,LG화학 연매출 20조원 수성…수익성 대폭 개선종합2보,1
17444,메시 사흘 만에 또 2골 추가…통산 502골 행진,5
14087,그리스 터키의 키프로스 시추 활동은 불법…통일협상 재개해야,4
13413,임대식 본부장 과학기술정책 연구자 중심으로 전환할 것,0
34991,中정부 중유럽 간 화물열차 빈 상태 복귀 지적 반박,4
41026,해남 땅끝 송호해수욕장 7월 13일 개장,3
40147,비대면 소비 시대…유통업과 배달업의 경계가 무너지고 있다,2
36043,두산 베어스 2018년 대학생 객원 마케터 모집,5
30810,삼성전자 28GHz 대역 5G 통합형 기지국 세계 최초 개발,0
21838,패장의 품격 차상현 감독 잘 싸웠다는 의미의 악수,5
8832,월드컵 신태용호 최종 엔트리 23명 FIFA 제출 완료,5
38492,KT 네팔 안나푸르나봉에 위치추적 산악구조센터 개소,2
23322,모스크바 도착한 이도훈 한반도평화교섭본부장,6
16574,전국 뒤덮은 황사에 곳곳 미세먼지 주의보…내일까지 극심,3
4641,UEFA 챔스리그 4강 마드리드 더비 성사…레알 vs 아...,5
15655,朴대통령 국론결집 호소…靑 대국민담화 성격종합,6
20928,답사기 중국편 쓴 유홍준 실크로드 만든 힘은 돈과 종교,3
25180,최고위원회의 참석하는 추미애와 홍영표,6
30093,朴대통령 수석회의 전격 연기…북핵·경제위기 대책에 집중종합,6
23250,문 대통령 아주 중요한 고비…아직 낙관할 수 없는 상황속보,6
13661,더민주 광주서 1박2일 20대 당선인 워크숍,6
26313,인구 90%가 도시에 사는데…좋은 도시란 무엇인가,2
36702,광주교육청 스쿨 미투 TF 운영 보고회 27일 개최,2
922,美대선 TV토론 美언론 힐러리 1승…트럼프 번번이 미끼 물어종합2보,4
23647,카메라뉴스 홍천 비발디파크서 국제 승마대회,3
42609,LG유플러스 5G로 굴삭기 원격 조종 지뢰제거 시연,1
20339,아동 성학대 혐의 호주 펠 추기경 대법원 상고,4
30310,방송독립시민행동 EBS 이사 후보 5명 부적격,2
429,중앙아 타지키스탄 교도소서 IS 조직원들 폭동…30여명 사망,4
42888,온라인 개학 점검하는 유은혜 부총리,6
21408,주택금융공사 신입직원 35명 공채…내달 8일까지 접수,1
14622,박지원 기치료·주사아줌마도 들어가는 靑…특검만 못들어가,6
34868,스마트폰 풀스크린 시대…노치 다음은 홀 디자인,0
41491,외환거래법 위반 막는다 은행연합회 고객안내서 배부,1
37215,상반기도 못 버틴다…항공업계 추가 지원책 어떤 내용 담길까,2
4133,구의역 사고 2주기 하루 앞두고,2
1456,물방울이 바위에 구멍 뚫듯…수행 끝에 만든 조각그림,3
8175,국제유가 이란발 공급충격 진정…WTI 0.6%↓,1
29867,폐암세포 성장 막는 화학물질 개발…세포실험서 효과 확인,0
15137,언론진흥재단 버스·택시 승강장 광고매체 전자지도 개발,2
16377,원달러 환율 5일간 3.8원 상승…1240원대 근접 금주 거래 마감,1
18351,中 트럼프 시위대 만나라 충고에 급한 건 폭력시위 진압,4
16959,현대카드 프리미엄 카드 패키지 새단장…책 형태로 가치전달,2
12241,묵념하는 문 대통령과 해외지역 한인사회 지도자들,6
19577,美 정보다 보니……軍 北미사일 발사 하루 지나 공개 논란,4
14567,AG 여자농구 단일팀 엔트리 확정…박지수 포함,5
17435,88㎏ 옐리치 본즈 이후 18년 만에 60홈런 시대 열까,5
45552,한권으로 읽는 실록 21년 대장정…박영규 역사 대중화 자부,3
16404,판문점선언 비준동의안 국무회의 상정…의결후 국회제출 예정,6
5278,여야정협의체 오늘 첫 회의…탕평채 오찬하며 협치 모색종합,6
3658,앙숙 터키·그리스 화해 모색…그리스 총리 성소피아 방문,4
33206,중증장애인 국가공무원 경력채용 21명 합격,2
32215,中 위안화 절상행진…고시 위안값 20개월만에 최고,4
30462,호주 다윈서 총격사건으로 최소 4명 사망…테러 연관성 없어,4
2846,류현진 수비 불안·좁은 스트라이크존 딛고 시즌 11승 달성,5
26866,경상일보 주최 제9회 울산야구대회 24일 개막,5
19679,게시판 LGU 골프엑스포서 Utv 체험부스 운영,0
19660,IOC 브라질 전현직 대통령 리우올림픽 개막식에 초청,4
44134,부산 해외이주민 32% 차별 경험 47.6% 배우자 폭력 속수무책,2
26761,추신수 2안타 1볼넷 3출루 활약…텍사스는 2연패,5
16288,국고채 금리 일제히 하락…3년물 연 2.231%,1
37441,은행권 상반기 기술금융 실적평가 1위 신한·경남은행,1
7890,정책기획위원회 오찬 간담회장의 문 대통령과 정해구 위원장,6
32309,게시판 통일부 제9기 대학생 기자단 모집,2
12308,러시아 월드컵 또 하나의 승자는 구글 번역기,0
37017,롯데백화점 5일부터 평창 스니커즈 판매,2
2832,홍콩 시민이 들고 있는 하늘이 중국 공산당을 멸할 것이다 손팻말,4
23342,이라크군 시위대 과잉진압 인정…유혈사태 진정될지 주목,4
41926,여성과기인센터 소장에 안혜연 사이버보안경영연구소 위원,0
1183,남자배구 20년간 못 나간 올림픽…도쿄는 꼭 가겠다,5
33724,신간 감정은 어떻게 전염되는가·보이지 않는 국가들,3
14623,삼성 2Q 세계 스마트폰 점유율 찜찜한 1위…중국 맹추격종합,0
21162,IBK투자 셀트리온 코스피200 편입 시 4천844억원 유입,1
32113,최정 6년 106억원에 SK와 잔류 계약…KBO 공식 최...,5
32249,뭘 고를까 고민되네…속속 드러나는 하반기 프리미엄폰,0
32654,신간 오버 더 초이스,3
5816,광화문광장 떠나는 영정,2
2288,중앙아프리카공화국서 유엔평화유지군 헬기 추락해 3명 사망,4
42179,인명구조 등에 사용될 드론,0
33328,세포 한 개도 콕 집어내는 신개념 조립로봇 개발,0
35784,흐려도 나들이엔 좋은 초가을…시내 붐비고 고속도로 정체,3
16203,정이현 단편소설 영영 여름 日 문예지에 소개,3
11017,코스닥 16년만에 900선 돌파…코스피도 2520선 탈환2보,1
