,title,topic_idx
20081,정의장 국회법 상정 사과 요구에 누워서 침뱉는 얘기,6
603,심장병 어린이돕기 희망농구 올스타 2018 5월 13일 개최,5
12803,터키 러시아제 S400 미사일 구매 강행두고 美터키 공방 가열,4
17599,법제처 대통령 개헌안 심사완료…내일 국무회의 안건 상정,6
10241,유엔 北 재래식 무기로 전용가능 물자목록 첫 공개,4
42823,한국문협작가상에 임지훈·안은순·문육자·박예자,3
16336,회색 도시서 펼치는 서커스 판타지,3
44896,50돌 롯데…신격호가 빌린 5만엔이 매출 92조원으로 성장,1
15789,이주의 뉴스키워드 인권침해 정치보복 하이라이트,2
44762,우진플라임 267억 규모 사출성형기 판매 계약,1
34903,갤럭시S9 오늘 70개국 공식출시…월말까지 110개국 확대,0
2835,개성공단 출입경 원활…오늘 체류인원 248명종합,6
36621,구직 열기,2
8427,곤 前닛산차 회장 나는 결백…지금 일어나는 것은 모략,4
8553,아시안게임 단일팀 이문규 감독 12일 훈련했지만 서너...,5
35202,안희정 새 지도자로 우리가 일어나야…충청대망론 가세종합,6
22670,특징주 美연준 금리인하 시사에 증권주 강세,1
3082,서민금융진흥원한국증권금융 휴면예금 출연 협약,1
6433,中企·소상공인 설 지원자금 27조6천억원 투입,1
4055,베트남 英에 냉동 트럭 희생자 수습팀 파견,4
28777,문대통령 징용 손배 판결 존중 개인 청구권 소멸 아니라는 것,6
15351,야스쿠니 폭발음 사건 한국인 징역 4년 선고1보,4
8841,SK텔레콤 평창올림픽 대비 재난안전통신망 구축,0
23065,프로농구 SK 김선형 부상 134일만인 28일 복귀,5
42699,법원 광주교육청 사립유치원들 비위 처분 적법,2
23296,부산 범죄 취약지역에 70억원 들여 CCTV 확대 설치,2
19293,부안 마실축제 성황…관광객 45만명 몰려,3
26246,朴대통령 내일 출국…北압박외교로 올해 첫 순방,6
25938,대만계 배우 가오이샹 예능 촬영 중 실신해 사망,2
25149,데이터 선물·충전·관리 한 곳에서…LGU 전용 앱 출시,0
13897,美금융사 가상화폐 경계령…비자 CEO 거래처리 안할 것,4
1099,G20 송환법 철폐 관심 가져달라…홍콩 시민들 대규모 시위,4
43367,병상 부족에 상주로 이송된 대구 확진자,2
43098,폭염에 건강 지키려면…야외활동 말고 카페인 음료 자제,3
15226,로엔엔터 드라마시장 진출…도깨비 제작사와 공동 투자,1
25934,LG V30 오늘 IFA서 공개…카메라·오디오로 마음 뺏는다,1
21650,춘천 닭갈비·막국수축제 개막…전국 장사씨름대회도,3
26845,박항서로 하나 된 한국베트남 합동 응원전 우리는 하나,5
20159,내일날씨 오늘보다 더 추워요…서울 영하5도·대관령 영하9도,3
29857,덱스터 영화 탈출에 74억원 투자 조달,1
7393,이학주 등 삼성 선수 32명 11월 2일부터 오키나와 마...,5
32366,평양정상회담 연설하는 김정은,6
13369,고은 詩 교과서에서 빠질까…교육부 출판사·저작자에 수정권,2
36943,8월 과학기술인상에 박호석 성균관대 교수,0
17707,美텍사스서 열기구 화재후 추락…최소 16명 사망한 듯종합,4
17525,블랙홀의 그림자 관측 성공…블랙홀 연구에 새 장 열려,0
45529,올해 이달의 기능 한국인 사연 모은 수기집 발간,3
9209,세기의 대국 알파고 약점 찾았다…묘수 연타 날려라,5
38903,이건희 차명계좌 제재 불투명…동창회계좌 등도 피해 없을 듯,2
40434,리비아 통합정부 사흘 안에 총반격 개시,4
15436,中 환율을 무역분쟁 도구로 이용하지 않을 것,4
24612,김정숙 여사 이한열 열사 모친 등 유가협 회원 靑초청 오찬,6
4461,경기 북부권 8개 시·군 오존주의보 두시간만에 해제종합,3
20286,대구 바람 어디로…대통령 가까운 후보 vs 역량 있는 후보,6
83,한국당 가짜뉴스 규제는 개인미디어 통제…입법화 반기,6
19128,카카오 아동 콘텐츠 서비스 카카오키즈 출시,1
5610,IMF총재 브라질·러시아 올해 역성장…中 경착륙 피할 듯,4
10417,NBA 보스턴 종료 24초 전까지 6점 뒤지다가 대역전극,5
5562,아시안게임 김학범 박항서 감독께 죄송…끝까지 정신력 ...,5
10460,대통령 소환투표 어서 시행하라 베네수엘라서 대규모 시위,4
41875,서울옥션 25일 홍콩경매에 브라운·워홀 등 초고가 출품,1
31748,문 대통령김정은 MDL서 역사적 만남…반갑게 악수속보,6
304,EU 北 미사일 추가 발사 비판…추가 도발 안 돼,4
28057,비트코인 거품 사이클 막바지 금융경색 단계에 근접,1
19312,프로축구2부 성남 수원FC와 00 비겨…살얼음 선두 행진,5
619,말컹 멀티골 경남 대구에 극장골 허용…22 무승부종합,5
36561,문재인정부 포용국가 비전 전면에…국민 전생애 생활보장종합,6
36213,프로축구 대전 광주에 10 승리…승강 PO 진출,5
8295,삼성 갤럭시S10으로 우주에서 셀피 마케팅…손흥민도 참여,0
16004,김재원 여야·비주류 안가리고 경청해 문제 해결할 것,6
14209,류현진 내일 신인 포수 스미스와 첫 배터리 호흡,5
40325,英 뮤지션 두아 리파 한국서 내 노래 나와 짜릿해요,3
4787,떠나자 인천공항 휴가 인파로 북적…출발 여행객 10만9천명,3
4680,얘기 나누는 조명균 장관과 송영길 위원장,6
2441,北 김정은 직총 7차대회 참석자들과 기념사진,6
36769,서울교육청 저소득층 지원 교육복지우선사업에 내년 144억 투입,2
17557,하반기 증시 핵심 변수는 G2무역분쟁·美금리 향방,1
22768,디오 180억5천만원 규모 자사주 처분 결정,1
16112,문화소식 국립중앙박물관 야외정원 안내도 제작,3
3669,동국실업 이근활 단독 대표이사 체제로 변경,2
45251,충북 코로나19 검사 학생 이틀 연속 10명대 유지,2
8170,올가을 휴대전화 싸질까…통신비 인하 여파 주목,0
28402,행정부 멈췄는데…국회는 차기 권력 셈법만·위기리더십 실종,6
20141,경쟁은 나의 힘 생존경쟁 통해 성장하는 신태용호 수비진,5
26812,LG G6 출시 이틀 만에 3만대 판매…산뜻한 출발,1
39931,한진그룹 코로나19로 절체절명 위기…조원태 체제 필수,1
23633,월드컵 김영권 독일 키커 선정 3차전 베스트11…골키...,5
29736,국고채 금리 하락세…3년물 연 2.201%,1
32605,스마트폰 분실 막는 스마트 트래커,0
1881,연 100만원이면 해외 지재권 분쟁 걱정 끝,3
22029,北 김정은 집권 5년차에도 공포정치 이어간다,6
8494,안철수 대표직 사퇴 모든 책임 제가 져야…千 동반 퇴진종합,6
41991,그래픽 빅히트엔터테인먼트 공모주 청약 마감 결과,1
5281,MLB 보스턴 총격당한 오티스 위해 구단 비행기 보내,5
40735,속보 유은혜 10월12일 이후 등교확대 여부는 감염병 추이 보고 판단,6
3540,트럼프 美법무부 서열 3위에 아시아계 여성 검사 지명,4
30743,특징주 뷰웍스 실적 부진 전망에 52주 신저가,1
3497,일본 푸에르토리코 꺾고 프리미어12 슈퍼라운드 예약,5
33512,야 3당 선거제개혁 내일까지 민주당과 패스트트랙 협상 완료종합,6
1869,中 돼지고기값 대홍수에 급등세…사상 최고치 육박 전망,4
6602,소말리아 괴한 케냐서 납치한 쿠바 의사들 몸값 18억원 요구,4
24603,프로농구 선두 DB 오리온에 역전승…2위와 격차 벌려,5
2247,NH투자 코스피 상장사 실적개선 가능…1850선 지지,1
19019,朴대통령 이란 세일즈외교차 출국…대기업 회장 대거 동행종합,6
42342,조선대 올해 등록금 동결…신입생 입학금은 인하,2
8293,KT 5G B2B 사업 박차…스마트팩토리 상품 3분기 출시,0
32883,김연경 12점 엑자시바시 챔프 3차전 패배…시리즈 1...,5
23077,신언 국가안보전략연구원장 김정은 통치자금 제재에 60% 감소,6
36078,LG유플러스 IoT 통신 LTEM1 전국망 서비스 개시,0
22088,부동자금 MMF 순자산 넉달 만에 120조원대 재진입,1
674,부활 시동 컵스 다르빗슈 시범경기 2이닝 3K 무실점,5
4066,신문협회 2018년 한국신문상 4편 선정,3
3607,한광옥 국민대통합위원장 탈북민 지원보다 배려가 중요,6
19673,브라질 상파울루 인근 도시 학교서 총기 난사…최소 8명 사망,4
16028,미래부→과기정통부로 탈바꿈…26일 현판식,2
7042,11월 9일은 소방의 날…소방청 제56회 기념식 개최,3
13596,설전 벌이는 김종민과 장제원,6
2587,국회 정상화 협상 데드라인 임박…與 6월 단독국회 소집 검토,6
19377,伊총리 獨·佛 등 5개국 지중해 구조 난민 수용 의사,4
21513,경주시민축구단 K3리그 챔피언십 통산 3회 우승,5
1306,이란 美 이란여객기 격추 31주기 추도식…위험한 쪽은 미국,4
39850,새출발하는 푸르덴셜생명…KB금융 안착·가치제고 최우선,1
16056,헬로모바일 10GB 요금제 인기…나흘 만에 5천명 가입,0
8916,문대통령 선거제 개편 이번에 꼭 해야 한다종합,6
10301,아시안게임 남자농구 허재 감독 변형수비로 클락슨 막은...,5
27317,서울 인터넷 속도 세계 1위…도쿄보다 2배 빨라종합,0
43537,울산대 영국기관 대학평가 국내 13위…지방종합대학 1위,2
43382,루푸스 맞춤치료 가능성 찾았다…글리벡도 효과,0
39147,태백시 학생 1인당 5만5천원 상당 농산물 꾸러미 지원,2
2490,라모스 R.마드리드서 뛴 100번째 유럽 대항전서 헤딩...,5
32894,러시아서 여객기 납치시도 소동…술 취한 남성 아프간에 가자종합,4
13663,망명중 정치활동 본격화하는 모랄레스…국경서 정당집회 열 것,4
30591,과학기술원 이산화탄소→탄소 전환기술 중기 이전,0
43610,위너스운용 파생상품 투자 800억 손실…KB증권과 책임공방 예고,1
12833,동장군 맹위…충북 제천 영하 16.5도,3
8825,북한날씨 대체로 맑음…일부 지역 소나기,3
4869,손경식 경총 회장 공정한 인사체제 만들고 회계 투명성 강화,2
15280,ETF 순자산 총액 21조원 돌파,1
29161,태풍 북상…제주 해상 풍랑특보 육상 강풍 예비특보,3
13421,룽투코리아 VR 게임 맞짱탁구 퍼블리싱 계약,0
8875,단통법 원년 통신사들 마케팅비 9천600억 줄였다종합,1
13561,한강 내 소설 빛을 향하니 어둡지 않아,3
30194,3월 주택 매매·전세 안정세…대출 규제 등 영향,1
33931,이스라엘 총선 한달 앞으로…네타냐후 총리 5선 험로 전망,4
35709,경기 김포 돼지농가 구제역 확진…방역 작업,2
20001,이란 美 제재 속 테헤란 국제공항 제2터미널 완공,4
40883,꼼꼼히 보면 좋은 기사…다음 뉴스 열독률 순위 신설,2
17576,평양공동선언 남북 정상 오찬 준비중인 옥류관,6
17836,유로존 2월 잠정 인플레이션 1.5%…ECB 목표치2.0% 밑돌아,1
40167,바른미래당 허철회 후보 세종시장 후보등록,6
17328,오승환·추신수 휴식…MLB 시범경기 맞대결 불발,5
5652,동정 허욱 방통위원 EBS 방송재난 대응훈련 점검,2
43738,김태호 겉과 속 다른 野 총선서 심판해야,6
42686,부산지하철 청소노동자 직접 고용 촉구,2
16372,영상 아이폰XS·XR 국내 출시…가장 선호하는 모델은,0
16023,주말 N 여행 옆에선 연신 잡아올리는데…산천어 낚시 꽝치지 않는 비법은,3
25952,방송독립시민행동 공영방송 이사 선임 관련 대토론회,2
22092,SKT 로밍서비스 바로 1년만에 400만명이 8천만건 통화,0
13005,러시아 골란고원 이스라엘 주권 인정 美 비판,4
23044,러 전문가 北 핵실험 여파로 북러 경협사업 위기,4
22870,올해 삼성·화웨이 스마트폰 점유율 3%포인트 차로 좁혀져,1
12529,알뜰폰에 SKT 저가 신규요금제 도매로 제공,0
23289,김정은 친정 하나은행 홈 개막전서 18득점…우리은행 2연승,5
524,안희정 급등·전인범 논란 악재 직면한 文…돌파카드 찾나종합,6
10681,광주에 대설주의보…오전 7시 현재 5.7㎝ 쌓여,3
29021,황총리 테러리즘과 폭력적 극단주의 척결에 힘쓸 것종합,6
35397,북미정상회담 한반도 평화구축 가속…7월 종전선언 이뤄질까,6
15565,상처만 남긴 채 무산된 SKT·헬로비전 MA,0
13776,동서고속도로 개통 D4…동해안 가는 길 뚫릴까 vs 막힐까,3
23265,아베 후쿠시마 원전서 양복 차림…방사능영향 감소 강조 의도,4
27982,백투백 홈런 2번…다저스 6홈런으로 콜로라도에 12연승,5
4541,롯데건설 원주 롯데캐슬 더 퍼스트 2차 이달 분양,1
31360,총선 관전포인트 제주 12년간 야당독식…이번에 바뀌나,6
42946,김종인오자와 전 간사장 회동,6
16920,권창훈 프랑스 디종 이적 확정…유럽진출 꿈 이뤘다,5
18520,게시판 KT DS 5G시대 동반성장 위한 파트너스 데이,0
7910,황선홍 중국 프로축구 옌볜 사령탑 취임,5
16558,국내프로농구 입단 앞둔 랜드리·티그…어 그 NBA 선수인가,5
14312,LG 오지환 KIA 양현종과 51번째 대결에서 첫 홈런…...,5
5396,네이버 작년 신기술 분야에 4천억원 넘게 투자,1
10416,냉전 이데올로기 넘어 새로운 동아시아 가치 구축해야,4
37340,비정규직이 실업급여를 받지 못한 이유는,2
5908,주말 N 여행 제주권 한라산 정상 해맞이…겨울바다 펭귄수영대회,3
32626,외딴 은하에서 태양 질량 170억배 블랙홀 발견,0
23038,교묘해지는 스팸전화 반년만에 60%↑…정부 대책 마련키로,2
16443,朴대통령 탄핵안 처리 국회 본회의 개의속보,6
36304,한컴 오피스 소프트웨어 기반 말랑말랑플랫폼 오픈,0
6824,KAIST이사회 총장 직무정지 결정 유보…공석사태 일단 모면종합2보,2
38913,조선총련 산하 가극단 내달 북한서 김일성 생일 기념 공연,6
41006,오늘의 투자전략 보수적 포트폴리오 비중 확대 필요,1
10369,북한기항 선박 국내입항 금지 근거 2011년 만들어,6
17331,이게 푸틴 스타일…지정학적 기술로 터키미국 갈라놓아WSJ,4
40578,日편의점체인 세븐일레븐 대표 24시간 영업 고집하다 경질,4
17817,삼성 갤럭시워치 LTE 출시…실구매가 20만원대,0
29583,北김정은 김정일 5주기에 대규모 야외 추모행사종합,6
19721,4대 금융투자협회장 선거 직접투표 생중계,2
8289,황희찬 시즌 16호골…잘츠부르크 컵대회 우승 2관왕,5
21351,클래식 회사 7곳 뭉쳤다…소속 간판 연주자들 한 무대에,3
22714,게시판 KT 인증 앱 모바일 접근성 인증 획득,0
11350,하나금투 비트코인 가격 오르면 채권금리도 오른다,1
21907,국민통합 시대 여행업계 韓中 관계개선으로 유커 돌아오도록 해야,3
28197,신간 왜 우리에게 기독교가 필요한가·이땅에 정의를,3
22291,에티오피아 총리 기업인 등 초청 참가비 2억원 호화 만찬,4
313,日매체 임창용·이대호·김태균 2010년대 日최고의 외인선수,5
13059,대구 부노자 자책골 인천에 10 승리…7위로 도약,5
2809,미군 주둔 이라크 기지에 또 로켓포 공격,4
25358,트럼프 독립기념일행사 연설계획에 美민주 정치 끼워넣지 마라,4
14509,스마트콘텐츠 중소기업에 올해 61억원 지원,1
9347,유엔 이라크 반정부 시위로 269명 사망,4
20753,서울연극제 대상에 집에 사는 몬스터,3
990,증시신상품 SK증권 최고 6% 수익추구 ELB 등 2종 공모,1
26005,한파에 얼어붙은 금원산 계곡,3
14195,사고계좌로 눈치…보이스피싱범 검거 기여 은행원 표창,2
10647,라바리니 김연경 의존 잦은 세터 교체로 개선 쉽지 않았다,5
44548,민주화운동기념사업회 민주시민교육 강사 양성과정 운영,2
19702,FIFA 월드컵 남미예선 아르헨페루전 경기장 예정대로,5
38305,배국환 전 기재부 2차관 삼표그룹 부회장 취임,2
20644,美 인구조사서 시민권 질문 부활하나…대법원도 동조기류,4
33544,베스트셀러 김훈 신작 공터에서 출간 직후 2위 올라,3
11906,LG 스마트폰공장 베트남 이전 후 적자 대폭 축소…V50S에 기대,0
32537,상반기 베스트셀러 1위는 이기주 언어의 온도,3
45512,특징주 크로바하이텍 대규모 증자 소식에 급락,1
27035,삼성 동남아 최대 차량 공유서비스 그랩과 제휴종합,2
5637,게시판 인터넷진흥원 한전과 데이터 안전활용 지원협력 확대,1
15486,비 또는 눈 내리는 휴일…충북 밤부터 기온 뚝,3
22803,박기원 대한항공 감독 정규리그 1위로 챔프전 가고 싶어,5
32053,슬로베니아 크로아티아 국경에 난민 차단 군병력 배치,4
28102,최진수 22점…오리온 LG 꺾고 최근 6승 2패 상승세종합,5
39617,수험생 체온관리 잘하세요…서울 체감온도 영하 4도,2
23796,멀티캠퍼스 3분기 영업익 63억원…66% 증가,1
41985,위클리 스마트 AI가 불러온 포털 개인화…뉴스 5줄은 뒤안길로,0
21789,체리폰 집중력 강화 헤드셋 IQ160 출시,1
7535,하나금투 로엔 올해도 성장세 지속…매수 추천,1
40561,한국노총 광주형 일자리 반대하는 민주노총에 그릇된 목소리,2
16211,고령층비고령층 스마트 격차 극심,2
2545,삼성전자 갤럭시S8 체험존 방문객 160만명 돌파,3
1789,여자농구 국민은행 신한은행 꺾고 선두 추격,5
25038,국고채 금리 소폭 상승…3년물 연 1.733%,1
1262,스노우맨 우체국알뜰폰 판매…TV·인터넷 결합상품 출시,0
29730,다음 앱·모바일 첫화면 개편…1분 콘텐츠 전면에,0
25692,프로배구 현대캐피탈 센터 차영석 오는 13일 결혼,5
37631,주택금융공사 디애셋誌 최우수 지속가능 금융기관상 수상,1
19368,영상 3년 동안 연인 알몸 영상 촬영·유포…피해자 국민청원에 호소,2
35834,갤노트9 행사장서 주인공 된 AI스피커…갤럭시홈 깜짝 등장,0
15094,두바이유 가격 이틀째 하락…배럴당 44달러 선으로,1
4788,출범 앞둔 과학기술혁신본부 …역할·인선 놓고 벌써 잡음,0
43067,비정규직 공동투쟁 중대재해기업처벌법 제정하라,2
29566,靑 北핵실험 가능성에 종합적 상황파악중,6
26953,카메라뉴스 보리밭 사잇길 걸어보세요,3
27566,노회찬 투신사망 계기로 본 정치자금 현실,6
5725,이란 첫 女권투선수 해외경기 뒤 체포영장 소문에 귀국취소,5
34804,LG디스플레이 2분기 영업이익 444억…90.9%↓2보,1
32895,인공지능 10년내 선진국 잡는다…전문인력 1만200명 양성,0
27835,오바마 논란의 여지없이 적합한 대법관후보 고르겠다,4
25097,강정호 7경기 연속 침묵 깨고 시즌 2호 홈런,5
23800,이란 정예군 혁명수비대 겨냥 자폭 공격…20여명 사망,4
17689,현대해상네이버 AI 플랫폼 기반 서비스 협약,0
39949,코로나19 여파 3월 사업체 종사자 22만5천명 급감…사상 첫 감소,2
33352,날씨 전국 흐리고 소나기…제주 장마 영향 벗어나30일,3
13080,적조 퇴치길 열리나…유전자의 구제물질 반응 최초로 규명,0
22582,533일 만의 등판 김광현 화려한 복귀전…5이닝 무실점,5
3312,인터뷰 류현진 같은 실수 안하려 해…전반기 내 점수 ...,5
44386,그래픽 민간 건설사 분양 계획,1
41348,서울 돈암초 야간당직자 코로나19 확진…등교수업 중지,2
7568,푸틴 내달 6일 아베와 소치서 정상회담,4
21923,안희정 대통령 민심은 탄핵 인정하고 내려놔야,6
27831,KT 5G 장비사로 삼성·에릭슨·노키아 선정…화웨이 제외종합,0
40837,이상문학상 손홍규 여전히 내 꿈은 소설가종합,3
39751,스페인 10개월 무정부 끝날 듯…야당 라호이 연임 허용 전망,4
22114,YTN 사장 후보 2명으로 압축…27일 이사회서 선임,2
37155,거래소 삼성전자 시총 30% 상한제 수시적용 검토종합,1
17041,서울보다 9배 넓은 공룡선거구 이대로 둘 것인가,6
7797,경기북부경찰 폭발물 처리 로봇 첫 시범 훈련,0
13400,73년 전통 기장시장 내주 가을축제 개막…체험행사 다채,3
17764,장미 만발한 조선대학교,3
7264,국민의당 더민주 호남행 촉각…텃밭사수 경계령,6
13890,대교 분기 배당 위해 주주명부 폐쇄,1
29393,저커버그 美 의회 청문회 증언 촉각…이미지 변신 안간힘,4
19059,서울시향 단원 재계약률 20% 불과…비정상적 운영 탓,2
5976,법조계 언론계 포토라인 문제점과 대안 모색,2
30780,게시판 신문협회 신문기자 진로탐색 프로그램 참여학교 모집,2
1773,개성공단 중단 북한 대응과 남북관계 전망…전문가 진단,6
40784,아동돌봄쿠폰 대형 카드사 전산오류로 수천명 사용 못해,2
44563,부산시·교육청 학원방역대응반 운영…대형학원 전수 점검,2
37877,수능 응원전 없는 수능,2
2539,獨 브레멘서 좌파3당 연정 합의…옛 서독지역 첫 좌파연정,4
3376,朴대통령·반총장 라오스 EAS서 같은 테이블 건배만찬종합,6
33180,청와대 을지연습 중단 가능한가 질문에 열어두고 있다,6
38151,대검찰청 도착한 윤석열 신임 검찰총장,2
36692,극발전소301 창단 10주년 기념연극 만리향 공연,3
20383,RP·MMF 건전성 규제 강화…비은행권 그림자금융 손본다,1
32027,코스피 트럼프·美 금리인상 우려 재부각에 1980선 후퇴종합,1
10737,KT 기가 인터넷 가입 100만 돌파,0
18575,박항서 매직 베트남 스즈키컵 결승 1차전서 22 무승부,5
5066,中 최대 한류상품박람회서 1천500만달러 MOU 성사,4
2704,사우디에겐 재앙인 석유시설 피격 러시아엔 무기 팔 기회,4
42126,암호화폐 소재 창작극…루킹 포 캐피탈리즘비트코인,3
16978,월드컵 통쾌한 반란 실패한 신태용 감독 골 운 따...,5
42943,특징주 신라젠 식약처 추가 임상 승인 소식에 상한가종합,1
43548,한국작가회의 새 임원 선출… 이경자 이사장과 한창훈 사무총장,2
19095,중국 제조업 활동 5개월째 위축…9월 PMI 49.8,4
5720,현대차그룹 현대중공업·현대상선 인수 관심없다,1
1816,오바마 폭력범죄ㆍ불법이민 증가 트럼프 주장 반박,4
20059,국민 76.5% 5G 최저요금 5만원 미만이 적절리얼미터,1
29761,보헤미안 랩소디 퀸 전시회…세계 최초 서울 개최,3
16515,류현진 아깝다 노히트…8회 1사 후 첫 안타 허용,5
4590,프로배구 KGC인삼공사 20192020시즌 새 유니폼 공개,5
21003,김상식 감독대행 공 없는 선수들 움직임이 좋았다,5
27944,네이버 지역 소상공인 지원 기술 AI 콜·테이블 주문 소개,0
2246,네이버 댓글 조작 여부 밝힌다…분석 사이트 등장,0
35577,이란 국제자금세탁방지기구 가입 무산될 듯,4
31877,역대 대통령들의 국회 특별연설 모습,6
28625,신한은행 기술형 우수 중소기업 대상 지식재산권 담보대출 출시,1
32367,무인전기차 도심 달렸다…미래기술의 모든 것종합,0
21732,LG CNS 아파트관리비 모바일고지서 서비스,1
38656,KB손보·서울대금융연 건강·보험·금융 공동연구,1
8796,中 핵안보 분야도 주도하겠다…핵안보시범센터 개설,4
3936,삼성 보급형 갤럭시M 시리즈 내년 1분기 출시 전망,0
29281,뼈 만드는 세포가 혈액 만드는 줄기세포 운명 결정,0
43277,성리학설 집대성 성리대전 완역 출간,3
38183,게시판 SK텔레콤 5GX 부스트파크에서 성탄절 행사,3
20355,내년 RD 예산 17조…반도체·미래차·바이오에 집중,1
32619,이번엔 성공할까…과기부 무인기로 인공강우 실험,0
44486,대전 꿈나래교육원 제8기 입교식…덕분에 챌린지도,2
32679,이란 UAE 이란과 관계 개선 위해 일부 조처,4
2233,천경자 고흐와 함께,3
41061,부산시 디지털 강사·서포터즈·교육생 모집,2
19758,U19 축구대표팀 툴롱컵 1차전에서 프랑스에 14 완패,5
21057,우간다르완다 긴장조성 행위 자제하기로…국경 재개방,4
12532,김정남 살해 혐의 베트남 여성 출소…오늘 저녁 귀국 전망2보,2
37088,경기 광주시장 망신주기 논란 나홀로 TF 연내 폐지,2
28392,신간 삶은 계속된다,3
40432,총력투쟁 선포하는 강원학교비정규직연대회의,2
42110,반려동물 건강해지면 포인트…카드쓸때 자투리돈 해외주식투자종합,1
21736,신태용 감독 이승우·구자철·문선민으로 투톱 만들 수 있다,5
24717,英서 시속 560km 전투기와 스카이 다이버 충돌할 뻔,2
8421,부산 LG유플러스 휴대전화 먹통 신고 500건 이상 접수,2
13388,무디스 삼성증권 등급 전망 부정적으로 하향 조정,1
44477,정경화·임동혁·용재 오닐 등 한 무대에…디토 10주년 축제,3
2997,8월 하순인데 열대야가…제주 열대야 44일로 역대 3번째,3
32228,트럼프 죽이러 왔다 트럼프 유세 중 살해 기도 19세 남성 기소,4
43307,이총리 한반도 평화 노력 곡절 있어도 결코 흔들리지 않을 것,6
